,id,trove_api_url,trove_url,trove_page_url,trove_pdf_url,heading,title,trove_title_url,trove_api_title_url,identifier,date,page,page_sequence,page_label,supplement,section,edition,spatial,illustrated,extent,type,abstract
233,4190524,https://api.trove.nla.gov.au/v3/newspaper/4190524,https://nla.gov.au/nla.news-article4190524,https://nla.gov.au/nla.news-page644193,https://trove.nla.gov.au/ndp/imageservice/nla.news-page644193/print,"THE GHOST. A VERY SERIES BALLAD. ""I'LL BE YOUR SECOND.""—LI[?]TON.",The Hobart Town Courier (Tas. : 1827 - 1839),https://nla.gov.au/nla.news-title19,https://api.trove.nla.gov.au/v3/newspaper/title/19,18354742;issn,1833-08-23,4.0,4,None,None,None,None,Tasmania,N,377 words,Article,"In Middle Row some years ago, There lived one Mr. Brown; And many folks considered him, The stoutest man in town."
234,41458166,https://api.trove.nla.gov.au/v3/newspaper/41458166,https://nla.gov.au/nla.news-article41458166,https://nla.gov.au/nla.news-page3607113,https://trove.nla.gov.au/ndp/imageservice/nla.news-page3607113/print|https://trove.nla.gov.au/ndp/imageservice/nla.news-page3607872/print,"THE EVERSLEY GHOST, AND HOW IT APPEARED ON CHRISTMAS NIGHT. A CHRISTMAS SKETCH.",Launceston Examiner (Tas. : 1842 - 1899),https://nla.gov.au/nla.news-title74,https://api.trove.nla.gov.au/v3/newspaper/title/74,18368204;issn,1863-01-03,2.0,2 S,None,None,None,MORNING.,Tasmania,N,5762 words,Article,"What do Tasmanians know of the pleasure of Christmas? How is it possible that they should, except by tradition ? They continue the old formality of wishing one another a"
235,39602889,https://api.trove.nla.gov.au/v3/newspaper/39602889,https://nla.gov.au/nla.news-article39602889,https://nla.gov.au/nla.news-page2952780,https://trove.nla.gov.au/ndp/imageservice/nla.news-page2952780/print,FICTION. FARMER MACK. WRITTEN FOR THE EXAMINER AND TASMANIAN. CHAPTER II.—THE GHOST.—CONTINUED.,Launceston Examiner (Tas. : 1842 - 1899),https://nla.gov.au/nla.news-title74,https://api.trove.nla.gov.au/v3/newspaper/title/74,18368204;issn,1895-03-02,3.0,3,None,None,None,None,Tasmania,N,2620 words,Article,"The lady smiled She had not seen Farmer Mack jogging along on his old grey mare, but she guessed something of the steed to which he was"
236,39603422,https://api.trove.nla.gov.au/v3/newspaper/39603422,https://nla.gov.au/nla.news-article39603422,https://nla.gov.au/nla.news-page2952828,https://trove.nla.gov.au/ndp/imageservice/nla.news-page2952828/print,FICTION. FARMER MACK. WRITTEN FOR THE EXAMINER AND TASMANIAN. CHAPTER III.—THE GHOST.—CONTINUED.,Launceston Examiner (Tas. : 1842 - 1899),https://nla.gov.au/nla.news-title74,https://api.trove.nla.gov.au/v3/newspaper/title/74,18368204;issn,1895-03-09,3.0,3,None,None,None,None,Tasmania,N,442 words,Article,"The hon. Mrs Fullard looked very pale, but said nothing, though the old lady who was suddenly roused by the unwonted light, immediately demanded"
237,8850999,https://api.trove.nla.gov.au/v3/newspaper/8850999,https://nla.gov.au/nla.news-article8850999,https://nla.gov.au/nla.news-page776542,https://trove.nla.gov.au/ndp/imageservice/nla.news-page776542/print,"AN AFGHAUN GHOST. (FROM THE NIGHT WANDERER IN AN AFGHAUN FORT, IN BLACKWOOD'S MAGAZINE.)","The Mercury (Hobart, Tas. : 1860 - 1954)",https://nla.gov.au/nla.news-title10,https://api.trove.nla.gov.au/v3/newspaper/title/10,10399992;issn,1868-03-11,3.0,3,None,None,None,None,Tasmania,N,2661 words,Article,"That evening, the last of my visit, I remained sleepless for many hours after throwing myself upon my bed. My mind was occupied in revolving the strange occurrences of the two past"
238,186371434,https://api.trove.nla.gov.au/v3/newspaper/186371434,https://nla.gov.au/nla.news-article186371434,https://nla.gov.au/nla.news-page20193556,https://trove.nla.gov.au/ndp/imageservice/nla.news-page20193556/print,"AN ARTISTS GHOST STORY, THE STRANGE EXPER[?] OF THOMAS REAP[?]Y THE LONDON ACADEMICIAN.","Devon Herald (Latrobe, Tas. : 1877 - 1889)",https://nla.gov.au/nla.news-title862,https://api.trove.nla.gov.au/v3/newspaper/title/862,22037071;issn,1883-07-11,1.0,1 S,None,Supplement to the Devon Herald,None,None,Tasmania,N,6593 words,Article,"A number of years ago there appeared in All the fear Round, then conducted by Charles DiIckesa, paper entitled “Four Stories.” One of them parported to be the supo[?]natural experience of"
240,65249184,https://api.trove.nla.gov.au/v3/newspaper/65249184,https://nla.gov.au/nla.news-article65249184,https://nla.gov.au/nla.news-page5229698,https://trove.nla.gov.au/ndp/imageservice/nla.news-page5229698/print,CONVICT DAYS VAN DIEMAN'S LAND. TRUE CHRONICLES.  NO. 6. THE GHOST OF DEADMAN'S ISLE.,Wellington Times and Agricultural and Mining Gazette (Tas. : 1890 - 1897),https://nla.gov.au/nla.news-title117,https://api.trove.nla.gov.au/v3/newspaper/title/117,18379702;issn,1891-06-03,2.0,2 S,None,The Wellington Times Supplement.,None,None,Tasmania,N,2750 words,Article,"It has been said that British history is [?]brined in Westminster Abbey and Saint Pauls. The great men, who sleep beneath their marble tablets in these venerable"
241,8851014,https://api.trove.nla.gov.au/v3/newspaper/8851014,https://nla.gov.au/nla.news-article8851014,https://nla.gov.au/nla.news-page776558,https://trove.nla.gov.au/ndp/imageservice/nla.news-page776558/print,"A GHOST STORY. (""A STRANGE CHRISTMAS GAME,"" BY MRS. J. H. RIDDELL, IN THE BROADWAY.)","The Mercury (Hobart, Tas. : 1860 - 1954)",https://nla.gov.au/nla.news-title10,https://api.trove.nla.gov.au/v3/newspaper/title/10,10399992;issn,1868-03-12,3.0,3,None,None,None,None,Tasmania,N,2059 words,Article,"It was the middle of November when we arrived at Martingdale, and found the place anything but romantic or pleasant. The walks were wet and sodden, the trees were leafless, there"
242,41458246,https://api.trove.nla.gov.au/v3/newspaper/41458246,https://nla.gov.au/nla.news-article41458246,https://nla.gov.au/nla.news-page3607101,https://trove.nla.gov.au/ndp/imageservice/nla.news-page3607101/print,THE EVERSLEY GHOST. HOW IT APPEARED ON CHRISTMAS NIGHT. A CHRISTMAS SKETCH. [CONTINUED FROM SATURDAY.],Launceston Examiner (Tas. : 1842 - 1899),https://nla.gov.au/nla.news-title74,https://api.trove.nla.gov.au/v3/newspaper/title/74,18368204;issn,1863-01-08,2.0,2 S,None,None,None,MORNING.,Tasmania,N,2375 words,Article,"The quadrille is over, and, a country dance follows, in which the lady portion of the drawing room people sit down and look out and the gentleman got partners and join in."
243,199525228,https://api.trove.nla.gov.au/v3/newspaper/199525228,https://nla.gov.au/nla.news-article199525228,https://nla.gov.au/nla.news-page22049524,https://trove.nla.gov.au/ndp/imageservice/nla.news-page22049524/print,"TALES & SKETCHES THE MISSION OF CAPTAIN BOB THOMPSON'S GHOST, A GALLANT RESCUE IN MID-OCEAN.","The Tasmanian (Launceston, Tas. : 1881 - 1895)",https://nla.gov.au/nla.news-title947,https://api.trove.nla.gov.au/v3/newspaper/title/947,2204583X;issn,1881-09-17,870.0,870,None,None,None,None,Tasmania,N,3436 words,Article,"""Of course, sir,"" said the old sailor the other day as we sat together as usual, ""it ain't necessary for me to tell you, as has know'd me those many years, that I"
244,41458338,https://api.trove.nla.gov.au/v3/newspaper/41458338,https://nla.gov.au/nla.news-article41458338,https://nla.gov.au/nla.news-page3607582,https://trove.nla.gov.au/ndp/imageservice/nla.news-page3607582/print,"THE EVERSLEY GHOST, AND HOW IT APPEARED ON CHRISTMAS NIGHT. A CHRISTMAS SKETCH. [CONCLUDED FROM THURSDAY.]",Launceston Examiner (Tas. : 1842 - 1899),https://nla.gov.au/nla.news-title74,https://api.trove.nla.gov.au/v3/newspaper/title/74,18368204;issn,1863-01-13,2.0,2 S,None,None,None,MORNING.,Tasmania,N,2584 words,Article,"Before coming down to dinner to-day, Lord Stoughton, finding his fusces all exhausted, pocketed some wax matches with his cigar case, and now he finds those useful. He takes"
245,233091908,https://api.trove.nla.gov.au/v3/newspaper/233091908,https://nla.gov.au/nla.news-article233091908,https://nla.gov.au/nla.news-page25212484,https://trove.nla.gov.au/ndp/imageservice/nla.news-page25212484/print,POETRY. HOW KERMANDIE NED LAID THE GHOST OF MAGUIRE. [A FACT: RELATED BY MAGUIRE’S MATE.],"The Tasmanian Democrat (Launceston, Tas. : 1891 - 1898)",https://nla.gov.au/nla.news-title1269,https://api.trove.nla.gov.au/v3/newspaper/title/1269,2206849X;issn,1894-08-18,4.0,4,None,None,None,None,Tasmania,N,768 words,Article,"In eighteen forty one, up to Macnamara’s run Came a sojer man from far beyant the says; He was togged out in a shtyle that bespoke"
246,232909754,https://api.trove.nla.gov.au/v3/newspaper/232909754,https://nla.gov.au/nla.news-article232909754,https://nla.gov.au/nla.news-page25199198,https://trove.nla.gov.au/ndp/imageservice/nla.news-page25199198/print,"TALES AND SKETCHES. THE GHOST OF THE “NUT.” AN ORIGINAL TALK, BY “J.H.R.” CHAPTER 1.","Cornwall Advertiser (Launceston, Tas. : 1870 - 1877)",https://nla.gov.au/nla.news-title1264,https://api.trove.nla.gov.au/v3/newspaper/title/1264,22068082;issn,1874-12-15,3.0,3,None,None,None,None,Tasmania,N,1692 words,Article,"It is May in the year 1880. The night was very dark. On such a night two persons, a male and a female, were walking on the short"
247,177546890,https://api.trove.nla.gov.au/v3/newspaper/177546890,https://nla.gov.au/nla.news-article177546890,https://nla.gov.au/nla.news-page20124884,https://trove.nla.gov.au/ndp/imageservice/nla.news-page20124884/print,TO THE EDITOR. [ WE DO NOT IDENTIFY OURSELVES WITH THE OPINIONS EXPRESSED BY OUR CORRESPONDENT.] THE GHOST,"Tasmanian News (Hobart, Tas. : 1883 - 1911)",https://nla.gov.au/nla.news-title866,https://api.trove.nla.gov.au/v3/newspaper/title/866,22037098;issn,1896-07-13,3.0,3 S,None,None,None,SECOND EDITION,Tasmania,N,121 words,Article,"If,—Would you kindly insert in your valuable paper the following suggestions which I believe would be the means of securing the ghost. There are"
248,232909777,https://api.trove.nla.gov.au/v3/newspaper/232909777,https://nla.gov.au/nla.news-article232909777,https://nla.gov.au/nla.news-page25199202,https://trove.nla.gov.au/ndp/imageservice/nla.news-page25199202/print,"TALES AND SKETCHES. THE GHOST OF THE “NUT.” AN ORIGINAL TALE, BY “J.H.R.” CHAPTER III. (CONCLUDED.)","Cornwall Advertiser (Launceston, Tas. : 1870 - 1877)",https://nla.gov.au/nla.news-title1264,https://api.trove.nla.gov.au/v3/newspaper/title/1264,22068082;issn,1874-12-18,3.0,3,None,None,None,None,Tasmania,N,1091 words,Article,"“ This is awful,” said Sandy. “Quick, Sandy!” hurriedly exclaimed Mr Decree. “Turn your dark lantern on, for the ghost touched"
249,41458031,https://api.trove.nla.gov.au/v3/newspaper/41458031,https://nla.gov.au/nla.news-article41458031,https://nla.gov.au/nla.news-page3649352,https://trove.nla.gov.au/ndp/imageservice/nla.news-page3649352/print,"INVERMAY POLICE. TO THE EDITOR OF THE LAUNCESTON EXAMINER. ""I'D TAKE THE GHOST'S WORD FOR A THOUSAND POUNDS."" —HAM'ET",Launceston Examiner (Tas. : 1842 - 1899),https://nla.gov.au/nla.news-title74,https://api.trove.nla.gov.au/v3/newspaper/title/74,18368204;issn,1862-12-27,3.0,3 S,None,None,None,MORNING.,Tasmania,N,946 words,Article,"SIR,—Doubtless you will be surprised at receiving a communication from a visitant from the other world; but be not alarmed, sir, for I come on a good errand, the purport of"
250,38290475,https://api.trove.nla.gov.au/v3/newspaper/38290475,https://nla.gov.au/nla.news-article38290475,https://nla.gov.au/nla.news-page3286537,https://trove.nla.gov.au/ndp/imageservice/nla.news-page3286537/print,CORRESPONDENCE. [WE DO NOT IDENTIFY OURSELVES WITH THE OPINIONS OF CORRESPONDENTS.] THE GHOST AND THE PRESBYTERY OF MELBOURNE. TO THE EDITOR.,Launceston Examiner (Tas. : 1842 - 1899),https://nla.gov.au/nla.news-title74,https://api.trove.nla.gov.au/v3/newspaper/title/74,18368204;issn,1883-10-08,3.0,3,None,None,None,None,Tasmania,N,969 words,Article,"SIR,—Unlike your correspondent ""The Ghost,"" I am not an expert in abuse, and consequently am incapable of replying to his penitential effusion after his own fashion. That"
251,39603942,https://api.trove.nla.gov.au/v3/newspaper/39603942,https://nla.gov.au/nla.news-article39603942,https://nla.gov.au/nla.news-page2952876,https://trove.nla.gov.au/ndp/imageservice/nla.news-page2952876/print,"FICTION. FARMER MACK. WRITTEN FOR THE EXAMINER AND TASMANIAN. AUTHOR OF 'MY LADY,' 'MADGE,' 'REX,' ETC. CHAPTER III.—THE GHOST.—CONTINUED.",Launceston Examiner (Tas. : 1842 - 1899),https://nla.gov.au/nla.news-title74,https://api.trove.nla.gov.au/v3/newspaper/title/74,18368204;issn,1895-03-16,3.0,3,None,None,None,None,Tasmania,N,1178 words,Article,"'Come home with me, lad,' he then said, a new idea breaking in upon him. 'Home! Where ?'"
252,199065698,https://api.trove.nla.gov.au/v3/newspaper/199065698,https://nla.gov.au/nla.news-article199065698,https://nla.gov.au/nla.news-page22039929,https://trove.nla.gov.au/ndp/imageservice/nla.news-page22039929/print|https://trove.nla.gov.au/ndp/imageservice/nla.news-page22039930/print,"TALES & SKETCHES. FARMER MACK. WRITTEN FOR THE EXAMINER AND TASMANIAN. BY ADELINE J. WHITFELD. AUTHOR OF 'MY LADY,' 'MADGE,' 'REX,' ETC. CHAPTER II.—THE GHOST.—CONTINUED.","The Tasmanian (Launceston, Tas. : 1881 - 1895)",https://nla.gov.au/nla.news-title947,https://api.trove.nla.gov.au/v3/newspaper/title/947,2204583X;issn,1895-03-02,3.0,3,None,None,None,None,Tasmania,N,2701 words,Article,"The lady smiled. She had not seen Farmer Mack jogging along on his old grey mare, but she guessed something of the steed to which he was"
253,8947373,https://api.trove.nla.gov.au/v3/newspaper/8947373,https://nla.gov.au/nla.news-article8947373,https://nla.gov.au/nla.news-page793827,https://trove.nla.gov.au/ndp/imageservice/nla.news-page793827/print,"THE PUBLIC SCHOOL AT CAMPBELL TOWN. ""WILL YE NEVER HA' DONE WHETTING YOUR KNIFE.""— (OLD SEROGGINS'S GHOST TO THE SHOEMAKER DOING IT ON HIS TOMBSTONE.)  TO THE EDITOR OF THE MERCURY.","The Mercury (Hobart, Tas. : 1860 - 1954)",https://nla.gov.au/nla.news-title10,https://api.trove.nla.gov.au/v3/newspaper/title/10,10399992;issn,1876-08-23,2.0,2,None,None,None,None,Tasmania,N,393 words,Article,"SIR,—Bear with us yet this once. A word on your foot-note to ours of 17th. Either you misunderstand or I did not clearly explain this matter, but ""were I twice as tedious, such is the love I"
272,163590674,https://api.trove.nla.gov.au/v3/newspaper/163590674,https://nla.gov.au/nla.news-article163590674,https://nla.gov.au/nla.news-page20136092,https://trove.nla.gov.au/ndp/imageservice/nla.news-page20136092/print,A LYING SPIRIT ABROAD.,"Tasmanian News (Hobart, Tas. : 1883 - 1911)",https://nla.gov.au/nla.news-title866,https://api.trove.nla.gov.au/v3/newspaper/title/866,22037098;issn,1891-05-25,2.0,2,None,None,None,None,Tasmania,N,1568 words,Article,"Mr LUCAS after his second crushing defeat in Kingborough [?] off reluctant, like an illus'd ghost."
332,233287877,https://api.trove.nla.gov.au/v3/newspaper/233287877,https://nla.gov.au/nla.news-article233287877,https://nla.gov.au/nla.news-page25211961,https://trove.nla.gov.au/ndp/imageservice/nla.news-page25211961/print,GHOSTS.,"The Tasmanian Democrat (Launceston, Tas. : 1891 - 1898)",https://nla.gov.au/nla.news-title1269,https://api.trove.nla.gov.au/v3/newspaper/title/1269,2206849X;issn,1896-08-14,3.0,3,None,None,None,None,Tasmania,N,211 words,Article,"The Hobart ghost seems to have taken himself away to the land of spooks again. As for  the Launceston spectre, we .doubt very much if he ever really existed. The"
342,233621417,https://api.trove.nla.gov.au/v3/newspaper/233621417,https://nla.gov.au/nla.news-article233621417,https://nla.gov.au/nla.news-page25168988,https://trove.nla.gov.au/ndp/imageservice/nla.news-page25168988/print,GHOSTS! GHOSTS! GHOSTS!,"The Weekly Times (Hobart Town, Tas. : 1863)",https://nla.gov.au/nla.news-title1249,https://api.trove.nla.gov.au/v3/newspaper/title/1249,22069399;issn,1863-10-03,3.0,3,None,None,None,None,Tasmania,N,814 words,Article,"The Rev. G. H. Moreton, a Church of England clergyman who officiates at St. James, in Sydney, has written a letter on “The ghost” which we copy"
348,198898932,https://api.trove.nla.gov.au/v3/newspaper/198898932,https://nla.gov.au/nla.news-article198898932,https://nla.gov.au/nla.news-page22035533,https://trove.nla.gov.au/ndp/imageservice/nla.news-page22035533/print,HAUNTED BY GHOSTS.,"The Tasmanian (Launceston, Tas. : 1881 - 1895)",https://nla.gov.au/nla.news-title947,https://api.trove.nla.gov.au/v3/newspaper/title/947,2204583X;issn,1895-07-13,6.0,6,None,None,None,None,Tasmania,N,190 words,Article,"It is not generally known, in connection with Rudyard Kipling's early life, that to be haunted by a terrible apparition, which toot the form of a grandmother's ghost,"
368,9020254,https://api.trove.nla.gov.au/v3/newspaper/9020254,https://nla.gov.au/nla.news-article9020254,https://nla.gov.au/nla.news-page800494,https://trove.nla.gov.au/ndp/imageservice/nla.news-page800494/print,PHYSICAL SCIENCE AND GHOSTS. [FROM THE LONDON SPECTATOR.],"The Mercury (Hobart, Tas. : 1860 - 1954)",https://nla.gov.au/nla.news-title10,https://api.trove.nla.gov.au/v3/newspaper/title/10,10399992;issn,1883-02-03,2.0,2 S,None,The Mercury Supplement.,None,None,Tasmania,N,992 words,Article,"The Pall Mall Gazette deprecates the inquiry into the authenticity of ghost stories promised by the ""Physical Research"" Society, for fear it should"
375,64885958,https://api.trove.nla.gov.au/v3/newspaper/64885958,https://nla.gov.au/nla.news-article64885958,https://nla.gov.au/nla.news-page5227897,https://trove.nla.gov.au/ndp/imageservice/nla.news-page5227897/print,A MYSTERIOUS APPARITION. A CHASE AFTER THE MYSTERY.,Wellington Times and Agricultural and Mining Gazette (Tas. : 1890 - 1897),https://nla.gov.au/nla.news-title117,https://api.trove.nla.gov.au/v3/newspaper/title/117,18379702;issn,1895-06-13,3.0,3,None,None,None,None,Tasmania,N,482 words,Article,"The Singleton correspondent of a Melbourne paper writes as follows:— The town is much excited over the supposed appearance of a ghost, Some years"
452,200299932,https://api.trove.nla.gov.au/v3/newspaper/200299932,https://nla.gov.au/nla.news-article200299932,https://nla.gov.au/nla.news-page22086870,https://trove.nla.gov.au/ndp/imageservice/nla.news-page22086870/print,PHOTOGRAPHIC GHOSTS.,"The Tasmanian (Launceston, Tas. : 1881 - 1895)",https://nla.gov.au/nla.news-title947,https://api.trove.nla.gov.au/v3/newspaper/title/947,2204583X;issn,1892-04-02,29.0,29,None,None,None,None,Tasmania,N,101 words,Article,"The ghost consists of a person completely covered with a sheet, so arranged as to give a dim outline of the head. When in position a short exposure of about half"
511,176569152,https://api.trove.nla.gov.au/v3/newspaper/176569152,https://nla.gov.au/nla.news-article176569152,https://nla.gov.au/nla.news-page20138767,https://trove.nla.gov.au/ndp/imageservice/nla.news-page20138767/print,THE GHOSTS MR. BESANT HAS SEEN.,"Tasmanian News (Hobart, Tas. : 1883 - 1911)",https://nla.gov.au/nla.news-title866,https://api.trove.nla.gov.au/v3/newspaper/title/866,22037098;issn,1891-10-05,4.0,4,None,None,None,None,Tasmania,N,780 words,Article,IN his weekly letter Mr Walter Besant has the following:—“A very good ghost story one of a churchyard and a phantom funeral (published in our columns under
654,4214705,https://api.trove.nla.gov.au/v3/newspaper/4214705,https://nla.gov.au/nla.news-article4214705,https://nla.gov.au/nla.news-page642131,https://trove.nla.gov.au/ndp/imageservice/nla.news-page642131/print,MORE GHOSTS.,The Hobart Town Courier (Tas. : 1827 - 1839),https://nla.gov.au/nla.news-title19,https://api.trove.nla.gov.au/v3/newspaper/title/19,18354742;issn,1829-08-22,4.0,4,None,None,None,None,Tasmania,N,1861 words,Article,"We had fondly hoped that with the exception of the rum ghost which we encountered lately in the cottage at New Norfolk, these new colonies were free from those creations of the brain and phantoms of"
675,83364501,https://api.trove.nla.gov.au/v3/newspaper/83364501,https://nla.gov.au/nla.news-article83364501,https://nla.gov.au/nla.news-page8365099,https://trove.nla.gov.au/ndp/imageservice/nla.news-page8365099/print,GHOSTS OUT WEST.,"The Clipper (Hobart, Tas. : 1893 - 1909)",https://nla.gov.au/nla.news-title271,https://api.trove.nla.gov.au/v3/newspaper/title/271,1839714X;issn,1895-05-04,2.0,2,None,None,None,None,Tasmania,N,485 words,Article,"Mr. Hosking, that ghost-raiser who has created a sensation in Hobart by his clever exhibition of spirits and curious things, is going out West to give the people round the mining places a turn."
735,39610095,https://api.trove.nla.gov.au/v3/newspaper/39610095,https://nla.gov.au/nla.news-article39610095,https://nla.gov.au/nla.news-page2953480,https://trove.nla.gov.au/ndp/imageservice/nla.news-page2953480/print,"SINGULAR OCCURRENCE AT SINGLETON. A MYSTERIOUS APPARITION. A CHASE AFTER THE MYSTERY. SINGLETON, TUESDAY.",Launceston Examiner (Tas. : 1842 - 1899),https://nla.gov.au/nla.news-title74,https://api.trove.nla.gov.au/v3/newspaper/title/74,18368204;issn,1895-06-11,6.0,6,None,None,None,None,Tasmania,N,475 words,Article,"The town is much excited over the supposed appearance of a ghost. Some years ago a man named Vickery, who had in his possession a large sum of money, is alleged"
759,8933929,https://api.trove.nla.gov.au/v3/newspaper/8933929,https://nla.gov.au/nla.news-article8933929,https://nla.gov.au/nla.news-page790953,https://trove.nla.gov.au/ndp/imageservice/nla.news-page790953/print,DETERIORATED BREED OF GHOSTS. [FROM THE SPECTATOR.],"The Mercury (Hobart, Tas. : 1860 - 1954)",https://nla.gov.au/nla.news-title10,https://api.trove.nla.gov.au/v3/newspaper/title/10,10399992;issn,1874-12-10,3.0,3,None,None,None,None,Tasmania,N,1396 words,Article,"Nothing is more remarkable in the democratic tendency of the age than the deterioration it has brought about in the manners and breeding of ghosts. The ghosts of a century, or even"
760,8868643,https://api.trove.nla.gov.au/v3/newspaper/8868643,https://nla.gov.au/nla.news-article8868643,https://nla.gov.au/nla.news-page783664,https://trove.nla.gov.au/ndp/imageservice/nla.news-page783664/print,DO GHOSTS WEAR BOOTS?,"The Mercury (Hobart, Tas. : 1860 - 1954)",https://nla.gov.au/nla.news-title10,https://api.trove.nla.gov.au/v3/newspaper/title/10,10399992;issn,1871-06-08,3.0,3,None,None,None,None,Tasmania,N,1065 words,Article,"At the Glamorgan Assizes, at Swansea, before Mr. Justice Mellor, James Shae, 36, plumber, who conducted his case with considerable intelligence, wits charged with burglariously breaking"
761,232957453,https://api.trove.nla.gov.au/v3/newspaper/232957453,https://nla.gov.au/nla.news-article232957453,https://nla.gov.au/nla.news-page25181404,https://trove.nla.gov.au/ndp/imageservice/nla.news-page25181404/print,THE PHANTOM SHIP.,"Tasmanian Punch (Hobart Town, Tas. : 1866)",https://nla.gov.au/nla.news-title1258,https://api.trove.nla.gov.au/v3/newspaper/title/1258,22069038;issn,1866-07-21,5.0,5,None,None,None,None,Tasmania,N,99 words,Article,"A recent ’ Extraordinary’ contains the following startling announcement:— “The Roderick Dhu, schooner, of Richmond, was totally wrecked 14 miles from Port Stevens, Coonamdara, and arrived safe at Broken"
763,8924982,https://api.trove.nla.gov.au/v3/newspaper/8924982,https://nla.gov.au/nla.news-article8924982,https://nla.gov.au/nla.news-page789386,https://trove.nla.gov.au/ndp/imageservice/nla.news-page789386/print,FOUR GHOSTS. [FROM THE NEW YORK TRIBUNE.],"The Mercury (Hobart, Tas. : 1860 - 1954)",https://nla.gov.au/nla.news-title10,https://api.trove.nla.gov.au/v3/newspaper/title/10,10399992;issn,1873-08-28,3.0,3,None,None,None,None,Tasmania,N,967 words,Article,"Mankind has a weakness for spectres. If we are to credit human testimony at all, a great mass of supernatural narrative still tests our scepticism, even with the largest allowances for"
764,8831577,https://api.trove.nla.gov.au/v3/newspaper/8831577,https://nla.gov.au/nla.news-article8831577,https://nla.gov.au/nla.news-page776536,https://trove.nla.gov.au/ndp/imageservice/nla.news-page776536/print,"GHOSTS. (FROM THE SPECTATOR, DEC. 24TH.)","The Mercury (Hobart, Tas. : 1860 - 1954)",https://nla.gov.au/nla.news-title10,https://api.trove.nla.gov.au/v3/newspaper/title/10,10399992;issn,1865-03-11,3.0,3,None,None,None,None,Tasmania,N,1993 words,Article,"Why ghosts always haunt Christmas, in every shape both literary and literal,1 is not very difficult to explain. Mr. Dickens, and story-tellers in general, always put them hy instinct into their"
773,39536534,https://api.trove.nla.gov.au/v3/newspaper/39536534,https://nla.gov.au/nla.news-article39536534,https://nla.gov.au/nla.news-page2932534,https://trove.nla.gov.au/ndp/imageservice/nla.news-page2932534/print,GHOSTS AND THEIR ORIGIN. (A SKETCH BY A. JAMIESON WRAINFORD.),Launceston Examiner (Tas. : 1842 - 1899),https://nla.gov.au/nla.news-title74,https://api.trove.nla.gov.au/v3/newspaper/title/74,18368204;issn,1887-09-26,3.0,3,None,None,None,None,Tasmania,N,1434 words,Article,"Much has been said and written on this subject, both true and untrue. 'Tis a common and ancient saying, that ""dead men tell no tales,"" that' tis the living we have"
