,id,trove_api_url,trove_url,trove_page_url,trove_pdf_url,heading,title,trove_title_url,trove_api_title_url,identifier,date,page,page_sequence,page_label,supplement,section,edition,spatial,illustrated,extent,type,abstract
195,199067796,https://api.trove.nla.gov.au/v3/newspaper/199067796,https://nla.gov.au/nla.news-article199067796,https://nla.gov.au/nla.news-page22040031,https://trove.nla.gov.au/ndp/imageservice/nla.news-page22040031/print|https://trove.nla.gov.au/ndp/imageservice/nla.news-page22040032/print,TALES & SKETCHES. FARMER MACK. CHAPTER III.—THE GHOST.—CONTINUED.,"The Tasmanian (Launceston, Tas. : 1881 - 1895)",https://nla.gov.au/nla.news-title947,https://api.trove.nla.gov.au/v3/newspaper/title/947,2204583X;issn,1895-03-16,3.0,3,None,None,None,None,Tasmania,N,2455 words,Article,"'Come home' with me, lad,' he then said, a new idea breaking in upon him. 'Home! Where?'"
196,149496237,https://api.trove.nla.gov.au/v3/newspaper/149496237,https://nla.gov.au/nla.news-article149496237,https://nla.gov.au/nla.news-page18295285,https://trove.nla.gov.au/ndp/imageservice/nla.news-page18295285/print,"SIR H. D. WOLFF'S GHOST STORY. ""A MYSTERIOUS SUMMONS.""","Daily Telegraph (Launceston, Tas. : 1883 - 1928)",https://nla.gov.au/nla.news-title742,https://api.trove.nla.gov.au/v3/newspaper/title/742,22029117;issn,1888-05-05,1.0,1 S,None,SUPPLEMENT THE DAILY TELEGRAPH,None,None,Tasmania,N,2090 words,Article,"The following story was told me by a lady. She was the wife of a rich squire in the east of England, after whose death she married a well-known Italian. She was a"
197,199064103,https://api.trove.nla.gov.au/v3/newspaper/199064103,https://nla.gov.au/nla.news-article199064103,https://nla.gov.au/nla.news-page22039981,https://trove.nla.gov.au/ndp/imageservice/nla.news-page22039981/print|https://trove.nla.gov.au/ndp/imageservice/nla.news-page22039982/print,TALES SKETCHES. FARMER MACK. CHAPTER III.-THE GHOST.—CONTINUED.,"The Tasmanian (Launceston, Tas. : 1881 - 1895)",https://nla.gov.au/nla.news-title947,https://api.trove.nla.gov.au/v3/newspaper/title/947,2204583X;issn,1895-03-09,3.0,3,None,None,None,None,Tasmania,N,2666 words,Article,"The hon. Mrs Fullard looked very pale, but said nothing, though the old lady who was suddenly roused by the unwonted light, immediately demanded"
198,72520475,https://api.trove.nla.gov.au/v3/newspaper/72520475,https://nla.gov.au/nla.news-article72520475,https://nla.gov.au/nla.news-page6955347,https://trove.nla.gov.au/ndp/imageservice/nla.news-page6955347/print,GREELEY'S GHOST. TO THE EDITOR OF THE CORNWALL CHRONICLE.,"The Cornwall Chronicle (Launceston, Tas. : 1835 - 1880)",https://nla.gov.au/nla.news-title170,https://api.trove.nla.gov.au/v3/newspaper/title/170,18389015;issn,1876-10-18,3.0,3,None,None,None,None,Tasmania,N,672 words,Article,"SIR,—Mr Trowell, the historian, made a remark in a speech delivered at Cape Town a your or two ago, to the effect that the"
199,201176644,https://api.trove.nla.gov.au/v3/newspaper/201176644,https://nla.gov.au/nla.news-article201176644,https://nla.gov.au/nla.news-page22133869,https://trove.nla.gov.au/ndp/imageservice/nla.news-page22133869/print,"SIR H. DRUMMOND WOLFF'S GHOST STORY. ""A MYSTERIOUS SUMMONS.""","The Colonist (Launceston, Tas. : 1888 - 1891)",https://nla.gov.au/nla.news-title952,https://api.trove.nla.gov.au/v3/newspaper/title/952,22046216;issn,1888-05-05,22.0,22,None,None,None,None,Tasmania,N,2166 words,Article,"The following story was told me by a lady. She was the wife of a rich squire in the east of England, after whose death she married a well-known Italian. She was a"
200,8794818,https://api.trove.nla.gov.au/v3/newspaper/8794818,https://nla.gov.au/nla.news-article8794818,https://nla.gov.au/nla.news-page770034,https://trove.nla.gov.au/ndp/imageservice/nla.news-page770034/print,GHOST--LORE. [REVIEW: FROM TUE SPECTATOR OF SEPT. 22.),"The Mercury (Hobart, Tas. : 1860 - 1954)",https://nla.gov.au/nla.news-title10,https://api.trove.nla.gov.au/v3/newspaper/title/10,10399992;issn,1860-12-06,3.0,3,None,None,None,None,Tasmania,N,2937 words,Article,"Footfalls on the Boundary of another World. With Narrative Illustrations. By Robert Dale Owen. From the tenth American Edition, with emendations and additions by the"
201,65224914,https://api.trove.nla.gov.au/v3/newspaper/65224914,https://nla.gov.au/nla.news-article65224914,https://nla.gov.au/nla.news-page6169945,https://trove.nla.gov.au/ndp/imageservice/nla.news-page6169945/print,INTERCOLONIAL. VICTORIA. THE BENDIGO GHOST SCARE. AN EXTRAORDINARY STORY.,Emu Bay Times and North West and West Coast Advocate (Tas. : 1897 - 1899),https://nla.gov.au/nla.news-title116,https://api.trove.nla.gov.au/v3/newspaper/title/116,18379699;issn,1898-09-06,2.0,2,None,None,None,None,Tasmania,N,249 words,Article,An extraordinary circumstance in connection with the prevailing ghost scare has been reported to the police. Constable Owens was called to the house of the young man
202,153546514,https://api.trove.nla.gov.au/v3/newspaper/153546514,https://nla.gov.au/nla.news-article153546514,https://nla.gov.au/nla.news-page18388325,https://trove.nla.gov.au/ndp/imageservice/nla.news-page18388325/print,A LONDON GHOST. STARTLING STORY OF AN UNCANNY APPARITION.,"Daily Telegraph (Launceston, Tas. : 1883 - 1928)",https://nla.gov.au/nla.news-title742,https://api.trove.nla.gov.au/v3/newspaper/title/742,22029117;issn,1894-05-05,7.0,7,None,None,None,None,Tasmania,N,441 words,Article,The good people of Brockley and Lewesham have been in a high state of excitement over a startling story of a ghost which has made its appearance in a lonely lane
203,199064986,https://api.trove.nla.gov.au/v3/newspaper/199064986,https://nla.gov.au/nla.news-article199064986,https://nla.gov.au/nla.news-page22039877,https://trove.nla.gov.au/ndp/imageservice/nla.news-page22039877/print|https://trove.nla.gov.au/ndp/imageservice/nla.news-page22039878/print,TALES & SKETCHES. FARMER MACK. CHAPTER II.—THE GHOST.—CONTINUED.,"The Tasmanian (Launceston, Tas. : 1881 - 1895)",https://nla.gov.au/nla.news-title947,https://api.trove.nla.gov.au/v3/newspaper/title/947,2204583X;issn,1895-02-23,3.0,3,None,None,None,None,Tasmania,N,2345 words,Article,"'It's moved! It's moved!' cried the little one feverishly. 'It skipped up the chimney, an' now its laughin' at me. I saw it hop up. Drive it out,"
204,8645145,https://api.trove.nla.gov.au/v3/newspaper/8645145,https://nla.gov.au/nla.news-article8645145,https://nla.gov.au/nla.news-page666742,https://trove.nla.gov.au/ndp/imageservice/nla.news-page666742/print,"A TRUE GHOST STORY. ""CONSCIENCE WAUNT! RICHARD'S HIMSELF AGAIN.""","Colonial Times (Hobart, Tas. : 1828 - 1857)",https://nla.gov.au/nla.news-title24,https://api.trove.nla.gov.au/v3/newspaper/title/24,18354734;issn,1830-05-28,3.0,3,None,None,None,None,Tasmania,N,493 words,Article,"A short time ago, a highly respectable gentleman of this place, had been visiting intimate friend at the village of New Town. The time had flown so fast, that ere the gentleman began to think of returning home, the moon had hid"
205,8851062,https://api.trove.nla.gov.au/v3/newspaper/8851062,https://nla.gov.au/nla.news-article8851062,https://nla.gov.au/nla.news-page776588,https://trove.nla.gov.au/ndp/imageservice/nla.news-page776588/print,THE GHOST IN THE LIGHT-HOUSE. (FROM AN AMERICAN PAPER.),"The Mercury (Hobart, Tas. : 1860 - 1954)",https://nla.gov.au/nla.news-title10,https://api.trove.nla.gov.au/v3/newspaper/title/10,10399992;issn,1868-03-14,3.0,3,None,None,None,None,Tasmania,N,1624 words,Article,Those who have visited Fortress Mouroethat great bulwark which preserved to the Union the control of the tido-waters of Virginia and Maryland during the late civil
206,232998824,https://api.trove.nla.gov.au/v3/newspaper/232998824,https://nla.gov.au/nla.news-article232998824,https://nla.gov.au/nla.news-page25196966,https://trove.nla.gov.au/ndp/imageservice/nla.news-page25196966/print|https://trove.nla.gov.au/ndp/imageservice/nla.news-page25196967/print|https://trove.nla.gov.au/ndp/imageservice/nla.news-page25196968/print,[?]ALES AND SKETCHES. [?]A CHRISTMAS STORY. [?]HE COACHMAN’S GHOST.,"Cornwall Advertiser (Launceston, Tas. : 1870 - 1877)",https://nla.gov.au/nla.news-title1264,https://api.trove.nla.gov.au/v3/newspaper/title/1264,22068082;issn,1870-12-23,3.0,3,None,None,None,None,Tasmania,N,5747 words,Article,"[?]hat a, pleasant thing it is for a man [?]aged in active London life, with all [?]dant bustle and anxiety, to find [?]himself able, when the merry"
207,8998724,https://api.trove.nla.gov.au/v3/newspaper/8998724,https://nla.gov.au/nla.news-article8998724,https://nla.gov.au/nla.news-page798027,https://trove.nla.gov.au/ndp/imageservice/nla.news-page798027/print,"THE SHOWMAN'S GHOST. [N.Y, WEEKLY HERALD.] CHAPTER II.—(CONTINUED.)","The Mercury (Hobart, Tas. : 1860 - 1954)",https://nla.gov.au/nla.news-title10,https://api.trove.nla.gov.au/v3/newspaper/title/10,10399992;issn,1881-07-09,1.0,1 S,None,The Mercury Supplement ,None,None,Tasmania,N,5242 words,Article,"Verschoyle and the Captain came from the saloon together. ""What have you to say to me?"" asked Verschoyle in a constrained and haughty tone."
208,66077458,https://api.trove.nla.gov.au/v3/newspaper/66077458,https://nla.gov.au/nla.news-article66077458,https://nla.gov.au/nla.news-page6433236,https://trove.nla.gov.au/ndp/imageservice/nla.news-page6433236/print,THE RINGWOOD GHOST. TO THE EDITOR OF THE CORNWALL CHRONICLE.,"The Cornwall Chronicle (Launceston, Tas. : 1835 - 1880)",https://nla.gov.au/nla.news-title170,https://api.trove.nla.gov.au/v3/newspaper/title/170,18389015;issn,1875-04-07,3.0,3,None,None,None,None,Tasmania,N,466 words,Article,SIR.—Do the electors of Ringwood observe and remember what they observe [?] they a care for their privileges and rights as electors? Have they adapted
209,65220697,https://api.trove.nla.gov.au/v3/newspaper/65220697,https://nla.gov.au/nla.news-article65220697,https://nla.gov.au/nla.news-page6170093,https://trove.nla.gov.au/ndp/imageservice/nla.news-page6170093/print,THE MAN WHO BOUGHT A GHOST. SUES FOR NON-DELIVERY.,Emu Bay Times and North West and West Coast Advocate (Tas. : 1897 - 1899),https://nla.gov.au/nla.news-title116,https://api.trove.nla.gov.au/v3/newspaper/title/116,18379699;issn,1898-11-29,4.0,4,None,None,None,None,Tasmania,N,1390 words,Article,"When the California Limited puiled out from the Dearborn strcet station on the night of January [?] 180—, the amoking room of the"
210,39481097,https://api.trove.nla.gov.au/v3/newspaper/39481097,https://nla.gov.au/nla.news-article39481097,https://nla.gov.au/nla.news-page2946603,https://trove.nla.gov.au/ndp/imageservice/nla.news-page2946603/print,HIS FATHER'S GHOST. (WRITTEN EXPRESSLY FOR CHRISTMAS SUPPLEMENT.) CHAPTER I.,Launceston Examiner (Tas. : 1842 - 1899),https://nla.gov.au/nla.news-title74,https://api.trove.nla.gov.au/v3/newspaper/title/74,18368204;issn,1892-12-24,3.0,3 S,None,CHRISTMAS SUPPLEMENT TO THE 'EXAMINER' & 'TASMANIAN.',None,None,Tasmania,N,2714 words,Article,"It was the evening of Christmas Day in Launceston. We—that is to say, Jack Digby, Ned Nuttal, and myself—were three solitary bachelors, and we had killed the day as best we might and now, in the evening gloaming, we sat under the verandah and"
211,8918947,https://api.trove.nla.gov.au/v3/newspaper/8918947,https://nla.gov.au/nla.news-article8918947,https://nla.gov.au/nla.news-page790232,https://trove.nla.gov.au/ndp/imageservice/nla.news-page790232/print,AN INDIANA GHOST SHOT [FROM THE LAFA[?]TT[?] IND. COURIER.],"The Mercury (Hobart, Tas. : 1860 - 1954)",https://nla.gov.au/nla.news-title10,https://api.trove.nla.gov.au/v3/newspaper/title/10,10399992;issn,1872-10-17,3.0,3,None,None,None,None,Tasmania,N,479 words,Article,"Since the advent of the Lafayette spooks, and the ghastly quadrille at the scene of the railroad, slaughter in Lauramie, the people of Shelby township have been in a high state of excitement,"
212,216215158,https://api.trove.nla.gov.au/v3/newspaper/216215158,https://nla.gov.au/nla.news-article216215158,https://nla.gov.au/nla.news-page23458848,https://trove.nla.gov.au/ndp/imageservice/nla.news-page23458848/print,THE O'BRIEN GHOST. THE WHITE FIGURE ON THE CLIFF.,"The Coastal News and North Western Advertiser (Ulverstone, Tas. : 1890 - 1893)",https://nla.gov.au/nla.news-title1077,https://api.trove.nla.gov.au/v3/newspaper/title/1077,22052593;issn,1891-05-23,4.0,4,None,None,None,None,Tasmania,N,889 words,Article,"(DR. W. H. RUSSELL IN THE ANTI-JACOBIN.) When I came into this property I was away abroad, and it was some time before the agent wrote to tell me the house was ready"
213,233686293,https://api.trove.nla.gov.au/v3/newspaper/233686293,https://nla.gov.au/nla.news-article233686293,https://nla.gov.au/nla.news-page25156448,https://trove.nla.gov.au/ndp/imageservice/nla.news-page25156448/print,BAR[?]ITO ; OR THE GHOST OF CUENCA. A SPANISH TALE.,"The Independent (Launceston, Tas. : 1831 - 1835)",https://nla.gov.au/nla.news-title1237,https://api.trove.nla.gov.au/v3/newspaper/title/1237,22068163;issn,1833-04-27,4.0,4,None,None,None,None,Tasmania,N,3262 words,Article,"Under the reign of Philip the Second, in the environs of Cu[?]nca in New Cas[?]ile, on the banks of the river Xucar, dwelt a rich hidalgo, named Don Lopez. He possessed"
214,232910516,https://api.trove.nla.gov.au/v3/newspaper/232910516,https://nla.gov.au/nla.news-article232910516,https://nla.gov.au/nla.news-page25195820,https://trove.nla.gov.au/ndp/imageservice/nla.news-page25195820/print,TALES AND SKETCHES. ALL FOR GOLD. A CHRISTMAS GHOST STORY.,"Cornwall Advertiser (Launceston, Tas. : 1870 - 1877)",https://nla.gov.au/nla.news-title1264,https://api.trove.nla.gov.au/v3/newspaper/title/1264,22068082;issn,1875-04-06,3.0,3,None,None,None,None,Tasmania,N,1848 words,Article,"There was not a prettier picture anywhere than the water mill, where the country people in the neighbourhood of Da[?]forth look their wheat"
215,200310568,https://api.trove.nla.gov.au/v3/newspaper/200310568,https://nla.gov.au/nla.news-article200310568,https://nla.gov.au/nla.news-page22080953,https://trove.nla.gov.au/ndp/imageservice/nla.news-page22080953/print,"""THE GHOST"" AND THE PRESBYTERY OF MELBOURNE. TO THE EDITOR.","The Tasmanian (Launceston, Tas. : 1881 - 1895)",https://nla.gov.au/nla.news-title947,https://api.trove.nla.gov.au/v3/newspaper/title/947,2204583X;issn,1883-09-15,1085.0,1085,None,None,None,None,Tasmania,N,973 words,Article,"SIR,—Your correspondent, ""The Ghost,"" in writing ""Echoes of Melbourne,"" which appeared in to-day's issue of the Examiner, has devoted a paragraph to the Presbytery of"
217,185223553,https://api.trove.nla.gov.au/v3/newspaper/185223553,https://nla.gov.au/nla.news-article185223553,https://nla.gov.au/nla.news-page20129919,https://trove.nla.gov.au/ndp/imageservice/nla.news-page20129919/print,GHOST OF THE HOUSE OF COMMONS. MRS MILMAN'S “ASTRAL BODY.,"Tasmanian News (Hobart, Tas. : 1883 - 1911)",https://nla.gov.au/nla.news-title866,https://api.trove.nla.gov.au/v3/newspaper/title/866,22037098;issn,1899-08-28,4.0,4 S,None,None,None,THIRD EDITION,Tasmania,N,333 words,Article,"During the last few days of June story was going about, says a London paper, that the rooms situated in the Speaker's Court, of A. J . C, Milman,"
218,153458914,https://api.trove.nla.gov.au/v3/newspaper/153458914,https://nla.gov.au/nla.news-article153458914,https://nla.gov.au/nla.news-page18382026,https://trove.nla.gov.au/ndp/imageservice/nla.news-page18382026/print,A PARISIAN SE[?]SATION. THE ANARCHIST HENRY. CONVERSATION WITH HIS GHOST.,"Daily Telegraph (Launceston, Tas. : 1883 - 1928)",https://nla.gov.au/nla.news-title742,https://api.trove.nla.gov.au/v3/newspaper/title/742,22029117;issn,1894-10-06,3.0,3,None,None,None,None,Tasmania,N,1476 words,Article,"Experiments in ""occultism""—spiritualism we call it in America have for some time been in vogue in Paris. Dr. Charcot, shortly before his death, thought physicians"
219,232910549,https://api.trove.nla.gov.au/v3/newspaper/232910549,https://nla.gov.au/nla.news-article232910549,https://nla.gov.au/nla.news-page25195824,https://trove.nla.gov.au/ndp/imageservice/nla.news-page25195824/print,TALES AND SKETCHES. ALL FOR GOLD. A CERISTMAS GHOST STORY (CONCLUDED),"Cornwall Advertiser (Launceston, Tas. : 1870 - 1877)",https://nla.gov.au/nla.news-title1264,https://api.trove.nla.gov.au/v3/newspaper/title/1264,22068082;issn,1875-04-09,3.0,3,None,None,None,None,Tasmania,N,1291 words,Article,"Frank Underwood, Esq., once the peasant youth, bow the wealthy manufacturer, sat,  at the head ol his own table in his own dining-iou[?]m."
220,62137165,https://api.trove.nla.gov.au/v3/newspaper/62137165,https://nla.gov.au/nla.news-article62137165,https://nla.gov.au/nla.news-page6164746,https://trove.nla.gov.au/ndp/imageservice/nla.news-page6164746/print,SOVEREIGNS AT LOGGERHEADS. HADES (FROM THE GHOST OF OUR OWN REPORTER.),"The Observer (Hobart, Tas. : 1845 - 1846)",https://nla.gov.au/nla.news-title160,https://api.trove.nla.gov.au/v3/newspaper/title/160,18383777;issn,1846-03-06,4.0,4,None,None,None,None,Tasmania,N,864 words,Article,THINGS are in a dreadfully disturbed state here. The announcement that it had been determined to erect statues of the Kings of England in your new [?]ouses of Parliament.
221,2960583,https://api.trove.nla.gov.au/v3/newspaper/2960583,https://nla.gov.au/nla.news-article2960583,https://nla.gov.au/nla.news-page637669,https://trove.nla.gov.au/ndp/imageservice/nla.news-page637669/print,"THE GHOST THAT APPEARED TO MRS. WHARTON. (FROM DICKENS'S ""HOUSEHOLD WORDS."")","The Courier (Hobart, Tas. : 1840 - 1859)",https://nla.gov.au/nla.news-title21,https://api.trove.nla.gov.au/v3/newspaper/title/21,18354769;issn,1851-07-12,4.0,4,None,None,None,None,Tasmania,N,4013 words,Article,"WHEN my mother was a girl, some romours began to steal through the town where she lived, about something having gone amiss with old Mrs. Wharton, for, If Mrs. Wharton was not known by all the"
222,163501823,https://api.trove.nla.gov.au/v3/newspaper/163501823,https://nla.gov.au/nla.news-article163501823,https://nla.gov.au/nla.news-page20204991,https://trove.nla.gov.au/ndp/imageservice/nla.news-page20204991/print,A GENUINE GHOST STORY. AN APPARITION OF 1842-3-4-5.,"Hobarton Guardian, or, True Friend of Tasmania (Hobart, Tas. : 1847 - 1854)",https://nla.gov.au/nla.news-title864,https://api.trove.nla.gov.au/v3/newspaper/title/864,22037144;issn,1848-01-29,4.0,4,None,None,None,None,Tasmania,N,1471 words,Article,IT was in the lovely autumn of 1843 : Augustus Sneblsigh was sitting in his shirt sleeves reading Whistling without a Master. He was practising some of
223,8866801,https://api.trove.nla.gov.au/v3/newspaper/8866801,https://nla.gov.au/nla.news-article8866801,https://nla.gov.au/nla.news-page782499,https://trove.nla.gov.au/ndp/imageservice/nla.news-page782499/print,"IN RE. RABBITS AND STRYCHNINE. TO THE ""GHOST AT LOWES' PARK.""","The Mercury (Hobart, Tas. : 1860 - 1954)",https://nla.gov.au/nla.news-title10,https://api.trove.nla.gov.au/v3/newspaper/title/10,10399992;issn,1871-04-05,3.0,3,None,None,None,None,Tasmania,N,1341 words,Article,"DEAR SIR (excuse the familiarity),—I have read with attention your communication in The Mercury of 29th, particularly that portion where you write "" There is still room to ponder over"
224,177547232,https://api.trove.nla.gov.au/v3/newspaper/177547232,https://nla.gov.au/nla.news-article177547232,https://nla.gov.au/nla.news-page20124905,https://trove.nla.gov.au/ndp/imageservice/nla.news-page20124905/print,"NORTHERN NEWS [BY TELEGRAPH.] THE GHOST FIEND IN LAUNCESTON . LONDON, JULY  18.","Tasmanian News (Hobart, Tas. : 1883 - 1911)",https://nla.gov.au/nla.news-title866,https://api.trove.nla.gov.au/v3/newspaper/title/866,22037098;issn,1896-07-18,4.0,4 S,None,None,None,THIRD EDITION,Tasmania,N,119 words,Article,"The ghost fiend is abroad Terrifying children. it is  alleged that the miscreant has found his way here from Hobart,"
225,9440592,https://api.trove.nla.gov.au/v3/newspaper/9440592,https://nla.gov.au/nla.news-article9440592,https://nla.gov.au/nla.news-page847527,https://trove.nla.gov.au/ndp/imageservice/nla.news-page847527/print,A SOUTH SEA TRAGEDY. THE SEA GHOST MASSACRE. HORRIBLE TALE OF BUTCHERY.,"The Mercury (Hobart, Tas. : 1860 - 1954)",https://nla.gov.au/nla.news-title10,https://api.trove.nla.gov.au/v3/newspaper/title/10,10399992;issn,1899-02-04,2.0,2,None,None,None,None,Tasmania,N,582 words,Article,The steamer Moresby arrived at Sydney on the 31st ult. after a cruise through British New Guinea and New Britain. The Moresby brought news regarding the Sea Ghost ma[?]sacre and
226,201156151,https://api.trove.nla.gov.au/v3/newspaper/201156151,https://nla.gov.au/nla.news-article201156151,https://nla.gov.au/nla.news-page22096402,https://trove.nla.gov.au/ndp/imageservice/nla.news-page22096402/print|https://trove.nla.gov.au/ndp/imageservice/nla.news-page22096403/print,TALES & SKETCHES. THE HOUSE BY THE COMMON. CHAPTER VIII.—MRS HUTCHINS'S GHOST.,"The Tasmanian (Launceston, Tas. : 1881 - 1895)",https://nla.gov.au/nla.news-title947,https://api.trove.nla.gov.au/v3/newspaper/title/947,2204583X;issn,1893-04-29,2.0,2,None,None,None,None,Tasmania,N,3376 words,Article,"It was certain that some one at The Friars needed the services of a medical man, and after my experiences of the previous night, I could hardly doubt that it"
227,201174603,https://api.trove.nla.gov.au/v3/newspaper/201174603,https://nla.gov.au/nla.news-article201174603,https://nla.gov.au/nla.news-page22133591,https://trove.nla.gov.au/ndp/imageservice/nla.news-page22133591/print|https://trove.nla.gov.au/ndp/imageservice/nla.news-page22133592/print,WHO IS THIS ACTOR? A GHOST STORY. CHAPTER I. A STRANGE LETTER.,"The Colonist (Launceston, Tas. : 1888 - 1891)",https://nla.gov.au/nla.news-title952,https://api.trove.nla.gov.au/v3/newspaper/title/952,22046216;issn,1888-02-25,21.0,21,None,None,None,None,Tasmania,N,5233 words,Article,"""Has Mr Gifford Moore como down to the theatre yet?"" ""Not yet, Miss Vernon,"" answered the stage-door keeper.; ""he is late, ain't he?"""
228,8866723,https://api.trove.nla.gov.au/v3/newspaper/8866723,https://nla.gov.au/nla.news-article8866723,https://nla.gov.au/nla.news-page784277,https://trove.nla.gov.au/ndp/imageservice/nla.news-page784277/print,"A NEW COOK-LANE GHOST. [FROM THE NEW YORK TIMES, MAY 3RD.]","The Mercury (Hobart, Tas. : 1860 - 1954)",https://nla.gov.au/nla.news-title10,https://api.trove.nla.gov.au/v3/newspaper/title/10,10399992;issn,1871-07-24,3.0,3,None,None,None,None,Tasmania,N,1103 words,Article,"There have recently been doings in Wayne Country, Ohio, as marvellous as any that ever frightened Cotton Maher, or mystified Dr. Johnson. In the little City of Wooster there lives a quiet and respectable"
229,8766094,https://api.trove.nla.gov.au/v3/newspaper/8766094,https://nla.gov.au/nla.news-article8766094,https://nla.gov.au/nla.news-page672306,https://trove.nla.gov.au/ndp/imageservice/nla.news-page672306/print,"AND TASMANIAN: HOBART TOWN: NOVEMBER 23, 1849. A GHOST OF THE MIDDLE AGESI","Colonial Times (Hobart, Tas. : 1828 - 1857)",https://nla.gov.au/nla.news-title24,https://api.trove.nla.gov.au/v3/newspaper/title/24,18354734;issn,1849-11-23,2.0,2,None,None,None,None,Tasmania,N,3123 words,Article,IT is seldom we descend from our usual Editorial functions to notice correspondents in the columns of a contemporary journal; but there are occasions when the question
230,39657814,https://api.trove.nla.gov.au/v3/newspaper/39657814,https://nla.gov.au/nla.news-article39657814,https://nla.gov.au/nla.news-page2955189,https://trove.nla.gov.au/ndp/imageservice/nla.news-page2955189/print,"A FATAL MISTAKE, OR MARRIED IN HASTE. CHAPTER XLII. THE GHOST-HAUNTED CHAMBER.",Launceston Examiner (Tas. : 1842 - 1899),https://nla.gov.au/nla.news-title74,https://api.trove.nla.gov.au/v3/newspaper/title/74,18368204;issn,1898-02-08,2.0,2,None,None,None,None,Tasmania,N,1466 words,Article,Daylight and a dreary autumnal morning made Adela's feelings anything but cheerfully disposed; still she resolved to remain a few days. Her
231,8821138,https://api.trove.nla.gov.au/v3/newspaper/8821138,https://nla.gov.au/nla.news-article8821138,https://nla.gov.au/nla.news-page774871,https://trove.nla.gov.au/ndp/imageservice/nla.news-page774871/print,"POLAND, THE GHOST THAT WILL NOT BE LAID. (FROM THE TIMES, JULY 22.)","The Mercury (Hobart, Tas. : 1860 - 1954)",https://nla.gov.au/nla.news-title10,https://api.trove.nla.gov.au/v3/newspaper/title/10,10399992;issn,1863-10-02,3.0,3,None,None,None,None,Tasmania,N,1697 words,Article,"In all human affairs there is something which perpetually springs up to baffle the wisest calculations and the vulgarest estimates of people and things. Such is Poland, the ghost"
232,38226661,https://api.trove.nla.gov.au/v3/newspaper/38226661,https://nla.gov.au/nla.news-article38226661,https://nla.gov.au/nla.news-page3293318,https://trove.nla.gov.au/ndp/imageservice/nla.news-page3293318/print,THE MISSION OF CAPTAIN BOB THOMPSON'S GHOST. A GALLANT RESCUE IN MID-OCEAN.,Launceston Examiner (Tas. : 1842 - 1899),https://nla.gov.au/nla.news-title74,https://api.trove.nla.gov.au/v3/newspaper/title/74,18368204;issn,1881-09-21,2.0,2 S,None,Supplement to the Launceston Examiner.,None,None,Tasmania,N,3611 words,Article,"""Of course, sir,"" said the old sailor the other day as we sat together as usual, ""it ain't necessary for me to tell you, as has know'd me these many years, that I"
