,id,trove_api_url,trove_url,trove_page_url,trove_pdf_url,heading,title,trove_title_url,trove_api_title_url,identifier,date,page,page_sequence,page_label,supplement,section,edition,spatial,illustrated,extent,type,abstract
103,199066340,https://api.trove.nla.gov.au/v3/newspaper/199066340,https://nla.gov.au/nla.news-article199066340,https://nla.gov.au/nla.news-page22039725,https://trove.nla.gov.au/ndp/imageservice/nla.news-page22039725/print|https://trove.nla.gov.au/ndp/imageservice/nla.news-page22039726/print,TALES & SKETCHES. THE HIGHWAYMAN'S GHOST.,"The Tasmanian (Launceston, Tas. : 1881 - 1895)",https://nla.gov.au/nla.news-title947,https://api.trove.nla.gov.au/v3/newspaper/title/947,2204583X;issn,1895-02-02,3.0,3,None,None,None,None,Tasmania,N,2950 words,Article,"When the fires burn frostily and the snow lies on the ground, visions of my father rise, clearly from the past. Once more I see his kindly face and"
104,39787331,https://api.trove.nla.gov.au/v3/newspaper/39787331,https://nla.gov.au/nla.news-article39787331,https://nla.gov.au/nla.news-page2957639,https://trove.nla.gov.au/ndp/imageservice/nla.news-page2957639/print,"PLAYING THE GHOST. HOBART, FRIDAY.",Launceston Examiner (Tas. : 1842 - 1899),https://nla.gov.au/nla.news-title74,https://api.trove.nla.gov.au/v3/newspaper/title/74,18368204;issn,1898-12-10,10.0,10,None,None,None,None,Tasmania,N,66 words,Article,"At the Police Court to-day three youths, named Joseph Archer, Albert and James Fulton, were sent to gaol for 14 days for playing the ghost at"
105,154097999,https://api.trove.nla.gov.au/v3/newspaper/154097999,https://nla.gov.au/nla.news-article154097999,https://nla.gov.au/nla.news-page18369361,https://trove.nla.gov.au/ndp/imageservice/nla.news-page18369361/print,[?] INTO COURT BY A GHOST,"Daily Telegraph (Launceston, Tas. : 1883 - 1928)",https://nla.gov.au/nla.news-title742,https://api.trove.nla.gov.au/v3/newspaper/title/742,22029117;issn,1897-12-22,8.0,8,None,None,None,None,Tasmania,N,339 words,Article,[?]
106,232870844,https://api.trove.nla.gov.au/v3/newspaper/232870844,https://nla.gov.au/nla.news-article232870844,https://nla.gov.au/nla.news-page25185723,https://trove.nla.gov.au/ndp/imageservice/nla.news-page25185723/print,THE GHOST OF PROTECTION. (TIMES.),"The Tasmanian Times (Hobart Town, Tas. : 1867 - 1870)",https://nla.gov.au/nla.news-title1263,https://api.trove.nla.gov.au/v3/newspaper/title/1263,22068511;issn,1870-04-04,3.0,3,None,None,None,None,Tasmania,N,1828 words,Article,"The ghost, of Protection, which lately strove to walk the world's stage once more under the guise of reciprocity, has been very summarily laid. Timid souls were alarmed, as is their"
107,233291639,https://api.trove.nla.gov.au/v3/newspaper/233291639,https://nla.gov.au/nla.news-article233291639,https://nla.gov.au/nla.news-page25212299,https://trove.nla.gov.au/ndp/imageservice/nla.news-page25212299/print,BLIND SOCIETY LAYS A GHOST.,"The Tasmanian Democrat (Launceston, Tas. : 1891 - 1898)",https://nla.gov.au/nla.news-title1269,https://api.trove.nla.gov.au/v3/newspaper/title/1269,2206849X;issn,1898-04-08,2.0,2,None,None,None,None,Tasmania,N,196 words,Article,"We have had quite a number of annual meetings of one sort and another, and among the most interesting was that of the Blind Deaf and Dumb Society, which Society, by"
108,264685918,https://api.trove.nla.gov.au/v3/newspaper/264685918,https://nla.gov.au/nla.news-article264685918,https://nla.gov.au/nla.news-page29634483,https://trove.nla.gov.au/ndp/imageservice/nla.news-page29634483/print,THE RUSSIAN GHOST OF LIBERTY.,"The Advertiser (Hobart, Tas. :  1861 - 1865)",https://nla.gov.au/nla.news-title1738,https://api.trove.nla.gov.au/v3/newspaper/title/1738,NDP00239;issn,1863-12-01,3.0,3,None,None,None,None,Tasmania,N,1589 words,Article,"Though not given to superstition, we are ready to own that ours is an age of phantoms. In the absence of anything substantial of a new or startling kind, in politics or religion, shadows are invoked of every"
109,153521491,https://api.trove.nla.gov.au/v3/newspaper/153521491,https://nla.gov.au/nla.news-article153521491,https://nla.gov.au/nla.news-page18385307,https://trove.nla.gov.au/ndp/imageservice/nla.news-page18385307/print,WHAT BECAME OF THE GHOST.,"Daily Telegraph (Launceston, Tas. : 1883 - 1928)",https://nla.gov.au/nla.news-title742,https://api.trove.nla.gov.au/v3/newspaper/title/742,22029117;issn,1896-12-23,7.0,7,None,None,None,None,Tasmania,N,1997 words,Article,Simmond was an execssive and unnecessary American That was the unsulnious verdict which his fellow-artists passed upon him when he made his first appearance in Paris.
110,198909291,https://api.trove.nla.gov.au/v3/newspaper/198909291,https://nla.gov.au/nla.news-article198909291,https://nla.gov.au/nla.news-page22043207,https://trove.nla.gov.au/ndp/imageservice/nla.news-page22043207/print,ENTERTAINMENTS. D'ARCY READ'S GHOST.,"The Tasmanian (Launceston, Tas. : 1871 - 1879)",https://nla.gov.au/nla.news-title946,https://api.trove.nla.gov.au/v3/newspaper/title/946,22045813;issn,1878-08-10,2.0,2,None,None,None,None,Tasmania,N,862 words,Article,"This ghostly entertainment, under the patronage of a large number of people — the larrikin element predominating—was held at the Pavilion,"
111,9022021,https://api.trove.nla.gov.au/v3/newspaper/9022021,https://nla.gov.au/nla.news-article9022021,https://nla.gov.au/nla.news-page801745,https://trove.nla.gov.au/ndp/imageservice/nla.news-page801745/print,A GHOST'S FALSE STORY. (GLOBE.),"The Mercury (Hobart, Tas. : 1860 - 1954)",https://nla.gov.au/nla.news-title10,https://api.trove.nla.gov.au/v3/newspaper/title/10,10399992;issn,1884-06-05,4.0,4,None,None,None,None,Tasmania,N,1669 words,Article,"Finis Allen, who is registered as a convict No. 2,993, has been serving a life sentence in Fort Madison Penitentiary, Iowa, since November 1879, for the"
112,153447003,https://api.trove.nla.gov.au/v3/newspaper/153447003,https://nla.gov.au/nla.news-article153447003,https://nla.gov.au/nla.news-page18381550,https://trove.nla.gov.au/ndp/imageservice/nla.news-page18381550/print,THE GHOST OF AMY ROBSART.,"Daily Telegraph (Launceston, Tas. : 1883 - 1928)",https://nla.gov.au/nla.news-title742,https://api.trove.nla.gov.au/v3/newspaper/title/742,22029117;issn,1894-06-09,7.0,7,None,None,None,None,Tasmania,N,476 words,Article,"A curious and protracted trial, in which Sir Walter Scott and the ghost of Amy Robart, the ill-tated wife of the Earl of Leicester, were involved, has come to an"
113,216216193,https://api.trove.nla.gov.au/v3/newspaper/216216193,https://nla.gov.au/nla.news-article216216193,https://nla.gov.au/nla.news-page23458652,https://trove.nla.gov.au/ndp/imageservice/nla.news-page23458652/print,THE GHOST-SEERS OF RERUN.,"The Coastal News and North Western Advertiser (Ulverstone, Tas. : 1890 - 1893)",https://nla.gov.au/nla.news-title1077,https://api.trove.nla.gov.au/v3/newspaper/title/1077,22052593;issn,1890-12-13,7.0,7,None,None,None,None,Tasmania,N,903 words,Article,"The German character certainly offers some very odd aud contradictory attributes. The British tourist who, Baedeker in hand, saunters through drowsy Hanover or busy Leipzig, or"
114,200625504,https://api.trove.nla.gov.au/v3/newspaper/200625504,https://nla.gov.au/nla.news-article200625504,https://nla.gov.au/nla.news-page22033148,https://trove.nla.gov.au/ndp/imageservice/nla.news-page22033148/print,A GHOST ON A BICYCLE.,"The North West Post (Formby, Tas. : 1887 - 1916)",https://nla.gov.au/nla.news-title949,https://api.trove.nla.gov.au/v3/newspaper/title/949,22046097;issn,1895-10-19,4.0,4,None,None,None,None,Tasmania,N,1525 words,Article,"I think perhaps it will be well to prefect this story with the remark, ""Do not read this unless you have experienced the manifold delights of riding a bicycle."""
115,177543732,https://api.trove.nla.gov.au/v3/newspaper/177543732,https://nla.gov.au/nla.news-article177543732,https://nla.gov.au/nla.news-page20124695,https://trove.nla.gov.au/ndp/imageservice/nla.news-page20124695/print,LOCAL NEWS PLAYING THE GHOST.,"Tasmanian News (Hobart, Tas. : 1883 - 1911)",https://nla.gov.au/nla.news-title866,https://api.trove.nla.gov.au/v3/newspaper/title/866,22037098;issn,1896-05-20,2.0,2 S,None,None,None,THIRD EDITION,Tasmania,N,190 words,Article,TIMID creatures have been nearly frightened out of their wits lately by the appearance of a white-rabed figure
116,39801534,https://api.trove.nla.gov.au/v3/newspaper/39801534,https://nla.gov.au/nla.news-article39801534,https://nla.gov.au/nla.news-page2958674,https://trove.nla.gov.au/ndp/imageservice/nla.news-page2958674/print,SEQUEL TO A GHOST STORY.,Launceston Examiner (Tas. : 1842 - 1899),https://nla.gov.au/nla.news-title74,https://api.trove.nla.gov.au/v3/newspaper/title/74,18368204;issn,1899-04-21,3.0,3,None,None,None,None,Tasmania,N,325 words,Article,"As a venerable minister tells this story, it would be ungracious and superfluous to adduce further evidence of its truthfulness. ""I went to a"
117,185243417,https://api.trove.nla.gov.au/v3/newspaper/185243417,https://nla.gov.au/nla.news-article185243417,https://nla.gov.au/nla.news-page20126341,https://trove.nla.gov.au/ndp/imageservice/nla.news-page20126341/print,THE GHOST AT SANDY BAY.,"Tasmanian News (Hobart, Tas. : 1883 - 1911)",https://nla.gov.au/nla.news-title866,https://api.trove.nla.gov.au/v3/newspaper/title/866,22037098;issn,1900-08-04,4.0,4 S,None,None,None,THIRD EDITION,Tasmania,N,150 words,Article,"MR FRANCIS H. VINE, photographer, of Sandy Bay, writes under to-day. date, as follows :—""In last night's News your Queen borough correspondent tells a fioe"
118,218204062,https://api.trove.nla.gov.au/v3/newspaper/218204062,https://nla.gov.au/nla.news-article218204062,https://nla.gov.au/nla.news-page23442912,https://trove.nla.gov.au/ndp/imageservice/nla.news-page23442912/print,A GHOST OF THE SIERRAS.,"Telegraph (Launceston, Tas. : 1881 - 1883)",https://nla.gov.au/nla.news-title1072,https://api.trove.nla.gov.au/v3/newspaper/title/1072,22052658;issn,1882-12-23,4.0,4 S,None,THE TELEGRAPH CHRISTMAS SUPPLEMENT,None,None,Tasmania,N,3255 words,Article,"It was a vast silence of pines redolent with balsamic breath, and muffled with the dry dust of dead bark and matted mosses. Lying on our backs, we looked"
119,232914731,https://api.trove.nla.gov.au/v3/newspaper/232914731,https://nla.gov.au/nla.news-article232914731,https://nla.gov.au/nla.news-page25196511,https://trove.nla.gov.au/ndp/imageservice/nla.news-page25196511/print,THE GHOST THAT JIM SAW.,"Cornwall Advertiser (Launceston, Tas. : 1870 - 1877)",https://nla.gov.au/nla.news-title1264,https://api.trove.nla.gov.au/v3/newspaper/title/1264,22068082;issn,1876-12-15,2.0,2,None,None,None,None,Tasmania,N,406 words,Article,"“Why, as to that,” said the engineer, “Ghosts ain'’ tilings we are apt to fear, Spirits don’t fool with levers much,"
120,82699635,https://api.trove.nla.gov.au/v3/newspaper/82699635,https://nla.gov.au/nla.news-article82699635,https://nla.gov.au/nla.news-page8366393,https://trove.nla.gov.au/ndp/imageservice/nla.news-page8366393/print,THE GHOST OF SANDY BAY.,"The Clipper (Hobart, Tas. : 1893 - 1909)",https://nla.gov.au/nla.news-title271,https://api.trove.nla.gov.au/v3/newspaper/title/271,1839714X;issn,1899-01-07,2.0,2,None,None,None,None,Tasmania,N,514 words,Article,"On New Year's Night a rather unusual experience befel four young fellows, who were proceeding homewards at what hour the ""church-yards yawn,"" etc. To hint for"
121,153551292,https://api.trove.nla.gov.au/v3/newspaper/153551292,https://nla.gov.au/nla.news-article153551292,https://nla.gov.au/nla.news-page18387803,https://trove.nla.gov.au/ndp/imageservice/nla.news-page18387803/print,THE DUEL A GHOST STORY.,"Daily Telegraph (Launceston, Tas. : 1883 - 1928)",https://nla.gov.au/nla.news-title742,https://api.trove.nla.gov.au/v3/newspaper/title/742,22029117;issn,1893-12-23,11.0,11,None,None,None,None,Tasmania,N,945 words,Article,"That's the evil of Practical joking; You never know where it may end, But may find that your fun has been choking"
122,162982452,https://api.trove.nla.gov.au/v3/newspaper/162982452,https://nla.gov.au/nla.news-article162982452,https://nla.gov.au/nla.news-page20001997,https://trove.nla.gov.au/ndp/imageservice/nla.news-page20001997/print,A BARRACK GHOST STORY. [CONCLUDED.],"Tasmanian News (Hobart, Tas. : 1883 - 1911)",https://nla.gov.au/nla.news-title866,https://api.trove.nla.gov.au/v3/newspaper/title/866,22037098;issn,1886-06-23,4.0,4,None,None,None,None,Tasmania,N,2217 words,Article,"Now for the sequel to my ghost story, which was related to me when I was released from durance vile. Between 2 and 3 o'clock on the"
123,36254666,https://api.trove.nla.gov.au/v3/newspaper/36254666,https://nla.gov.au/nla.news-article36254666,https://nla.gov.au/nla.news-page3642017,https://trove.nla.gov.au/ndp/imageservice/nla.news-page3642017/print,A MISCHIEVOUS GHOST IN LONDON.,Launceston Examiner (Tas. : 1842 - 1899),https://nla.gov.au/nla.news-title74,https://api.trove.nla.gov.au/v3/newspaper/title/74,18368204;issn,1848-05-10,4.0,4 S,None,None,None,AFTERNOON,Tasmania,N,530 words,Article,"The whole of the neighbourhood of Black Lion Lane, Bayswater, is ringing with the extraordinary occurrences that have recently happened in the house of a Mr. Williams, in"
125,8831475,https://api.trove.nla.gov.au/v3/newspaper/8831475,https://nla.gov.au/nla.news-article8831475,https://nla.gov.au/nla.news-page776457,https://trove.nla.gov.au/ndp/imageservice/nla.news-page776457/print,"A RUSSIAN GHOST STORY. (FROM MY AUNT ANN'S GHOST STORY, IN BLACKWOOD'S MARGAZINE.)","The Mercury (Hobart, Tas. : 1860 - 1954)",https://nla.gov.au/nla.news-title10,https://api.trove.nla.gov.au/v3/newspaper/title/10,10399992;issn,1865-03-06,3.0,3,None,None,None,None,Tasmania,N,3474 words,Article,"The first thing which my sister-in-law asked me next morning was whether I had heard the sounds in the night. On my admitting that I had, she said that she had not felt so frightened as upon"
126,232508035,https://api.trove.nla.gov.au/v3/newspaper/232508035,https://nla.gov.au/nla.news-article232508035,https://nla.gov.au/nla.news-page25167294,https://trove.nla.gov.au/ndp/imageservice/nla.news-page25167294/print,THE WEDDING RING A GHOST STORY,"Tasmanian Weekly News (Hobart Town, Tas. : 1858)",https://nla.gov.au/nla.news-title1246,https://api.trove.nla.gov.au/v3/newspaper/title/1246,22068945;issn,1858-04-03,5.0,5,None,None,None,None,Tasmania,N,3377 words,Article,"A large gaunt house stood at the corner of two streets of London. The fire was blazing with such great flashes up the wide chimney that, by  common consent, all the"
127,65216344,https://api.trove.nla.gov.au/v3/newspaper/65216344,https://nla.gov.au/nla.news-article65216344,https://nla.gov.au/nla.news-page6169520,https://trove.nla.gov.au/ndp/imageservice/nla.news-page6169520/print,THE STORY OF THE GHOST'S WATCH.,Emu Bay Times and North West and West Coast Advocate (Tas. : 1897 - 1899),https://nla.gov.au/nla.news-title116,https://api.trove.nla.gov.au/v3/newspaper/title/116,18379699;issn,1897-12-25,3.0,3,None,None,None,None,Tasmania,N,2276 words,Article,"'What a curious old watch I don't remember seeing it on you before. Where did you pick [?] up, old man?' This form me, Charles Gardner, to my friend and"
128,13271083,https://api.trove.nla.gov.au/v3/newspaper/13271083,https://nla.gov.au/nla.news-article13271083,https://nla.gov.au/nla.news-page841082,https://trove.nla.gov.au/ndp/imageservice/nla.news-page841082/print,WAS IT A GHOST THEY SAW?,"The Mercury (Hobart, Tas. : 1860 - 1954)",https://nla.gov.au/nla.news-title10,https://api.trove.nla.gov.au/v3/newspaper/title/10,10399992;issn,1893-10-28,2.0,2 S,None,The Mercury Supplement,None,None,Tasmania,N,754 words,Article,"Mrs. H. H. JENNINGS lives at No. 211, Main-street, Bridgeport, and Miss Minnie Parrot boards with her. The house is an old one, but in good order. One night early"
129,152388569,https://api.trove.nla.gov.au/v3/newspaper/152388569,https://nla.gov.au/nla.news-article152388569,https://nla.gov.au/nla.news-page18371068,https://trove.nla.gov.au/ndp/imageservice/nla.news-page18371068/print,BOLTER'S BED-FELLOW. A GHOST STORY.,"Daily Telegraph (Launceston, Tas. : 1883 - 1928)",https://nla.gov.au/nla.news-title742,https://api.trove.nla.gov.au/v3/newspaper/title/742,22029117;issn,1898-12-21,11.0,11,None,None,None,None,Tasmania,N,29 words,Article,Well at [?] of four [?] We arrived to the
130,199544988,https://api.trove.nla.gov.au/v3/newspaper/199544988,https://nla.gov.au/nla.news-article199544988,https://nla.gov.au/nla.news-page22092057,https://trove.nla.gov.au/ndp/imageservice/nla.news-page22092057/print,WAS IT A GHOST THEY SAW ?,"The Tasmanian (Launceston, Tas. : 1881 - 1895)",https://nla.gov.au/nla.news-title947,https://api.trove.nla.gov.au/v3/newspaper/title/947,2204583X;issn,1893-09-23,4.0,4,None,None,None,None,Tasmania,N,894 words,Article,"Mrs H. H. Jennings lives at No 211, Main Street, Bridgeport, and Miss Minnie Parrot boards with her. The house is an old one, but in good order. One night"
132,198898006,https://api.trove.nla.gov.au/v3/newspaper/198898006,https://nla.gov.au/nla.news-article198898006,https://nla.gov.au/nla.news-page22036150,https://trove.nla.gov.au/ndp/imageservice/nla.news-page22036150/print,THE GHOST OF THE OLD FORT.,"The Tasmanian (Launceston, Tas. : 1881 - 1895)",https://nla.gov.au/nla.news-title947,https://api.trove.nla.gov.au/v3/newspaper/title/947,2204583X;issn,1895-10-05,4.0,4,None,None,None,None,Tasmania,N,1630 words,Article,"Some eight years ago, when my regiment was quartered in the Madras Presidency I made one of a large party to visit the old fort of Seringapatam. We"
133,233015953,https://api.trove.nla.gov.au/v3/newspaper/233015953,https://nla.gov.au/nla.news-article233015953,https://nla.gov.au/nla.news-page25183432,https://trove.nla.gov.au/ndp/imageservice/nla.news-page25183432/print,FOR THE BAIRNS. BILLY’S GHOST.,"The Federalist (Launceston, Tas. : 1898 - 1899)",https://nla.gov.au/nla.news-title1268,https://api.trove.nla.gov.au/v3/newspaper/title/1268,22068120;issn,1899-04-08,2.0,2,None,None,None,None,Tasmania,N,633 words,Article,"Billy Morrison was a freckled-faced lad of fourteen; broad-shouldered, thick-set, and, I regret to say, very short both in stature and temper. He was pugnacious, and thought"
134,83369168,https://api.trove.nla.gov.au/v3/newspaper/83369168,https://nla.gov.au/nla.news-article83369168,https://nla.gov.au/nla.news-page8365616,https://trove.nla.gov.au/ndp/imageservice/nla.news-page8365616/print,ODE TO GOSSIPS A GHOST'S MONODY.,"The Clipper (Hobart, Tas. : 1893 - 1909)",https://nla.gov.au/nla.news-title271,https://api.trove.nla.gov.au/v3/newspaper/title/271,1839714X;issn,1896-08-08,5.0,5,None,None,None,None,Tasmania,N,235 words,Article,whose homes betray the slattern trail of dust and grime and odors state while idle stands the broom and pail—The gossips.
136,232909150,https://api.trove.nla.gov.au/v3/newspaper/232909150,https://nla.gov.au/nla.news-article232909150,https://nla.gov.au/nla.news-page25199094,https://trove.nla.gov.au/ndp/imageservice/nla.news-page25199094/print,TALES AND SKETCHES. THE GARRISON GHOST.,"Cornwall Advertiser (Launceston, Tas. : 1870 - 1877)",https://nla.gov.au/nla.news-title1264,https://api.trove.nla.gov.au/v3/newspaper/title/1264,22068082;issn,1874-09-15,3.0,3,None,None,None,None,Tasmania,N,1642 words,Article,The fort of which my father was appointed commandant was situated on a rocky promontory in one of the wildest though most romantic parts
142,232508097,https://api.trove.nla.gov.au/v3/newspaper/232508097,https://nla.gov.au/nla.news-article232508097,https://nla.gov.au/nla.news-page25167308,https://trove.nla.gov.au/ndp/imageservice/nla.news-page25167308/print|https://trove.nla.gov.au/ndp/imageservice/nla.news-page25167309/print,THE WEDDING RING: A GHOST STORY.,"Tasmanian Weekly News (Hobart Town, Tas. : 1858)",https://nla.gov.au/nla.news-title1246,https://api.trove.nla.gov.au/v3/newspaper/title/1246,22068945;issn,1858-04-10,3.0,3,None,None,None,None,Tasmania,N,3550 words,Article,"“Winmere, who heard this valediction uttered something about those who are, nice in selecting investments ought to be, and always are, careful in the matter of"
143,216216927,https://api.trove.nla.gov.au/v3/newspaper/216216927,https://nla.gov.au/nla.news-article216216927,https://nla.gov.au/nla.news-page23458995,https://trove.nla.gov.au/ndp/imageservice/nla.news-page23458995/print,AN UP TO DATE GHOST STORY.,"The Coastal News and North Western Advertiser (Ulverstone, Tas. : 1890 - 1893)",https://nla.gov.au/nla.news-title1077,https://api.trove.nla.gov.au/v3/newspaper/title/1077,22052593;issn,1892-01-09,5.0,5,None,None,None,None,Tasmania,N,980 words,Article,"""Having been concerned in a most remarkable and altogether inexplicable adventure the other evening, which happened to me in Thomas lane, Knotty Ash, I have been"
144,177556412,https://api.trove.nla.gov.au/v3/newspaper/177556412,https://nla.gov.au/nla.news-article177556412,https://nla.gov.au/nla.news-page20125450,https://trove.nla.gov.au/ndp/imageservice/nla.news-page20125450/print,A GHOST REFUSING TO BE[?]AID.,"Tasmanian News (Hobart, Tas. : 1883 - 1911)",https://nla.gov.au/nla.news-title866,https://api.trove.nla.gov.au/v3/newspaper/title/866,22037098;issn,1896-12-22,3.0,3 S,None,None,None,THIRD EDITION,Tasmania,N,310 words,Article,IN spite of all the talk about our ''so called  a [?] century'' and its [?] and materialism [?] is at lesst as popular with was   never was
145,83366126,https://api.trove.nla.gov.au/v3/newspaper/83366126,https://nla.gov.au/nla.news-article83366126,https://nla.gov.au/nla.news-page8365176,https://trove.nla.gov.au/ndp/imageservice/nla.news-page8365176/print,ODE TO BUMMERS. A GHOST'S MONODY.,"The Clipper (Hobart, Tas. : 1893 - 1909)",https://nla.gov.au/nla.news-title271,https://api.trove.nla.gov.au/v3/newspaper/title/271,1839714X;issn,1895-07-20,5.0,5,None,None,None,None,Tasmania,N,232 words,Article,"Who loudly to their brother churls, Make rude remarks about the girls, And call them donahs, barto, and pearls ? The Bummers!"
146,172889283,https://api.trove.nla.gov.au/v3/newspaper/172889283,https://nla.gov.au/nla.news-article172889283,https://nla.gov.au/nla.news-page20121930,https://trove.nla.gov.au/ndp/imageservice/nla.news-page20121930/print,GHOST AND WAR DANCES IN MONTANA.,"Tasmanian News (Hobart, Tas. : 1883 - 1911)",https://nla.gov.au/nla.news-title866,https://api.trove.nla.gov.au/v3/newspaper/title/866,22037098;issn,1897-08-31,3.0,3 S,None,None,None,THIRD EDITION,Tasmania,N,851 words,Article,"It is the custom, says the New York [?], upon the occasion of each Indian uprising at any of the Western agencies, to assign some special [?],"
147,8819348,https://api.trove.nla.gov.au/v3/newspaper/8819348,https://nla.gov.au/nla.news-article8819348,https://nla.gov.au/nla.news-page774097,https://trove.nla.gov.au/ndp/imageservice/nla.news-page774097/print,THE PATENT GHOST. [FROM THE SPECTATAR.],"The Mercury (Hobart, Tas. : 1860 - 1954)",https://nla.gov.au/nla.news-title10,https://api.trove.nla.gov.au/v3/newspaper/title/10,10399992;issn,1863-07-21,3.0,3,None,None,None,None,Tasmania,N,977 words,Article,Modern researches in spiritualism have led to one practical result—the discovery of a ghost. Not of an ordinary old-fashioned ghost appearing in the midnight hour to people with a
148,232906631,https://api.trove.nla.gov.au/v3/newspaper/232906631,https://nla.gov.au/nla.news-article232906631,https://nla.gov.au/nla.news-page25198670,https://trove.nla.gov.au/ndp/imageservice/nla.news-page25198670/print,TALES AND SKETCHES. THE VILLAGE GHOST.,"Cornwall Advertiser (Launceston, Tas. : 1870 - 1877)",https://nla.gov.au/nla.news-title1264,https://api.trove.nla.gov.au/v3/newspaper/title/1264,22068082;issn,1873-09-16,3.0,3,None,None,None,None,Tasmania,N,1633 words,Article,"I was seated one morning in my office as a partial representative of the Dozy Doolittle Department, Dull-street, when I experienced a"
149,153540691,https://api.trove.nla.gov.au/v3/newspaper/153540691,https://nla.gov.au/nla.news-article153540691,https://nla.gov.au/nla.news-page18388393,https://trove.nla.gov.au/ndp/imageservice/nla.news-page18388393/print,A BURGLAR FRIGHTENED BY A GHOST.,"Daily Telegraph (Launceston, Tas. : 1883 - 1928)",https://nla.gov.au/nla.news-title742,https://api.trove.nla.gov.au/v3/newspaper/title/742,22029117;issn,1894-05-23,3.0,3,None,None,None,None,Tasmania,N,484 words,Article,"""The Tramp"" reports:—A rather sensational occurrence took place at the house of Mr John Woodberry, jun., Whitefoord Hills, at 2 a.m. on Sunday last. Mrs Woodberry,"
150,233095138,https://api.trove.nla.gov.au/v3/newspaper/233095138,https://nla.gov.au/nla.news-article233095138,https://nla.gov.au/nla.news-page25212760,https://trove.nla.gov.au/ndp/imageservice/nla.news-page25212760/print,THE GHOST OF THE BLUE CHAMBER,"The Tasmanian Democrat (Launceston, Tas. : 1891 - 1898)",https://nla.gov.au/nla.news-title1269,https://api.trove.nla.gov.au/v3/newspaper/title/1269,2206849X;issn,1895-12-20,2.0,2,None,None,None,None,Tasmania,N,1547 words,Article,"Uncle John told us a story. Uncle John said : Perhaps we were not aware of it, but there was a haunted room in that very house. He said that for years nobody had been able"
