,id,trove_api_url,trove_url,trove_page_url,trove_pdf_url,heading,title,trove_title_url,trove_api_title_url,identifier,date,page,page_sequence,page_label,supplement,section,edition,spatial,illustrated,extent,type,abstract
0,65247087,https://api.trove.nla.gov.au/v3/newspaper/65247087,https://nla.gov.au/nla.news-article65247087,https://nla.gov.au/nla.news-page5230210,https://trove.nla.gov.au/ndp/imageservice/nla.news-page5230210/print,GHOST CUT GHOST.,Wellington Times and Agricultural and Mining Gazette (Tas. : 1890 - 1897),https://nla.gov.au/nla.news-title117,https://api.trove.nla.gov.au/v3/newspaper/title/117,18379702;issn,1892-03-26,1.0,1 S,None,Supplement to the Wellington Times.,None,None,Tasmania,N,2520 words,Article,You may imagine that during my career as a detective I have had some singular jobs given me to work on. There was one [?] pierce of business that I always look back
1,39584756,https://api.trove.nla.gov.au/v3/newspaper/39584756,https://nla.gov.au/nla.news-article39584756,https://nla.gov.au/nla.news-page2948079,https://trove.nla.gov.au/ndp/imageservice/nla.news-page2948079/print|https://trove.nla.gov.au/ndp/imageservice/nla.news-page2948080/print,GUSTAV'S GHOST.,Launceston Examiner (Tas. : 1842 - 1899),https://nla.gov.au/nla.news-title74,https://api.trove.nla.gov.au/v3/newspaper/title/74,18368204;issn,1891-12-24,7.0,7 S,None,"CHRISTMAS SUPPLEMENT TO THE Launceston Examiner: 
COMMERCIAL ADVERTISER.",None,None,Tasmania,N,5372 words,Article,"People were congratulating each other n the arrival of another old-fashioned Christmas; they seemed quite to enjoy being chilly for so good a cause, and on so"
2,91156303,https://api.trove.nla.gov.au/v3/newspaper/91156303,https://nla.gov.au/nla.news-article91156303,https://nla.gov.au/nla.news-page8322601,https://trove.nla.gov.au/ndp/imageservice/nla.news-page8322601/print,"THE ""GHOST.""",Launceston Examiner (Tas. : 1842 - 1899),https://nla.gov.au/nla.news-title74,https://api.trove.nla.gov.au/v3/newspaper/title/74,18368204;issn,1896-07-13,6.0,6,None,None,None,None,Tasmania,N,136 words,Article,"The senseless individual who for weeks past has been acting ""the ghost"" in and around the city has not yet been captured, notwithstanding the"
3,233287452,https://api.trove.nla.gov.au/v3/newspaper/233287452,https://nla.gov.au/nla.news-article233287452,https://nla.gov.au/nla.news-page25211920,https://trove.nla.gov.au/ndp/imageservice/nla.news-page25211920/print,ANOTHER GHOST.,"The Tasmanian Democrat (Launceston, Tas. : 1891 - 1898)",https://nla.gov.au/nla.news-title1269,https://api.trove.nla.gov.au/v3/newspaper/title/1269,2206849X;issn,1896-06-05,2.0,2,None,None,None,None,Tasmania,N,267 words,Article,"The Launceston Telegraph is again endeavoring to raise the ghost of provincial protection, in order to scare the guileless farmers"
4,153761918,https://api.trove.nla.gov.au/v3/newspaper/153761918,https://nla.gov.au/nla.news-article153761918,https://nla.gov.au/nla.news-page18374827,https://trove.nla.gov.au/ndp/imageservice/nla.news-page18374827/print,MADAME'S GHOST,"Daily Telegraph (Launceston, Tas. : 1883 - 1928)",https://nla.gov.au/nla.news-title742,https://api.trove.nla.gov.au/v3/newspaper/title/742,22029117;issn,1900-12-19,13.0,13,None,None,None,None,Tasmania,N,2129 words,Article,"It was a [?] old bouse, built, in the time of the first Bonsparte. A French lady, tradition said the was a connection of Napolecn's of a vevy dear"
5,4222117,https://api.trove.nla.gov.au/v3/newspaper/4222117,https://nla.gov.au/nla.news-article4222117,https://nla.gov.au/nla.news-page641664,https://trove.nla.gov.au/ndp/imageservice/nla.news-page641664/print,MARY'S GHOST.,The Hobart Town Courier (Tas. : 1827 - 1839),https://nla.gov.au/nla.news-title19,https://api.trove.nla.gov.au/v3/newspaper/title/19,18354742;issn,1828-06-14,3.0,3,None,None,None,None,Tasmania,N,546 words,Article,"'Twas in the middle of the night, To sleep young William tried, When Mary's ghost came stealing in, And stood at his bedside."
6,84659158,https://api.trove.nla.gov.au/v3/newspaper/84659158,https://nla.gov.au/nla.news-article84659158,https://nla.gov.au/nla.news-page8628304,https://trove.nla.gov.au/ndp/imageservice/nla.news-page8628304/print,THE GHOST.,Zeehan and Dundas Herald (Tas. : 1890 - 1922),https://nla.gov.au/nla.news-title270,https://api.trove.nla.gov.au/v3/newspaper/title/270,18397158;issn,1898-02-02,3.0,3,None,None,None,None,Tasmania,N,324 words,Article,A friend of the wife had turned up. A nice. lively girl. and they sat up rather late on the first night. Finally they went to bed. She upstairs to the strangers
8,66064372,https://api.trove.nla.gov.au/v3/newspaper/66064372,https://nla.gov.au/nla.news-article66064372,https://nla.gov.au/nla.news-page6234224,https://trove.nla.gov.au/ndp/imageservice/nla.news-page6234224/print,HEENAN'S GHOST.,"The Cornwall Chronicle (Launceston, Tas. : 1835 - 1880)",https://nla.gov.au/nla.news-title170,https://api.trove.nla.gov.au/v3/newspaper/title/170,18389015;issn,1878-03-13,4.0,4,None,None,None,None,Tasmania,N,543 words,Article,"The best bit we have read for months in a Yankoc paper la the revival of the ghost of a departed [?]—""The ghost of a once famous [?] J. C. [?] was"
9,200374186,https://api.trove.nla.gov.au/v3/newspaper/200374186,https://nla.gov.au/nla.news-article200374186,https://nla.gov.au/nla.news-page22161692,https://trove.nla.gov.au/ndp/imageservice/nla.news-page22161692/print,A GHOST.,"The Tasmanian Tribune (Hobart Town, Tas. : 1872 - 1876)",https://nla.gov.au/nla.news-title950,https://api.trove.nla.gov.au/v3/newspaper/title/950,22046321;issn,1873-08-19,2.0,2,None,None,None,None,Tasmania,N,237 words,Article,"The Melbourne correspondent of the Bendigo Advertiser says.--""A story comes to my knowledge which borders on the mysterious, but perhaps the"
10,233681395,https://api.trove.nla.gov.au/v3/newspaper/233681395,https://nla.gov.au/nla.news-article233681395,https://nla.gov.au/nla.news-page25335901,https://trove.nla.gov.au/ndp/imageservice/nla.news-page25335901/print,GHOST STORIES.,"Weekly Examiner (Launceston, Tas. : 1872 - 1878)",https://nla.gov.au/nla.news-title1266,https://api.trove.nla.gov.au/v3/newspaper/title/1266,22068538;issn,1878-06-15,14.0,14,None,None,None,None,Tasmania,N,353 words,Article,"An extraordinary story is related to the Melbourne Herald, which, writes that journal, may give some comfort to believers in ghosts, if not to anyone else."
15,153489530,https://api.trove.nla.gov.au/v3/newspaper/153489530,https://nla.gov.au/nla.news-article153489530,https://nla.gov.au/nla.news-page18384463,https://trove.nla.gov.au/ndp/imageservice/nla.news-page18384463/print,PLAYING GHOST.,"Daily Telegraph (Launceston, Tas. : 1883 - 1928)",https://nla.gov.au/nla.news-title742,https://api.trove.nla.gov.au/v3/newspaper/title/742,22029117;issn,1896-06-03,3.0,3,None,None,None,None,Tasmania,N,67 words,Article,"HOBART, TUESDAY.—Playing at ghost is still being indulged in by some thoughtless individual, much to the discomfiture of women and children, several of whom have"
16,233002951,https://api.trove.nla.gov.au/v3/newspaper/233002951,https://nla.gov.au/nla.news-article233002951,https://nla.gov.au/nla.news-page25198208,https://trove.nla.gov.au/ndp/imageservice/nla.news-page25198208/print,PAWKINS’ GHOST.,"Cornwall Advertiser (Launceston, Tas. : 1870 - 1877)",https://nla.gov.au/nla.news-title1264,https://api.trove.nla.gov.au/v3/newspaper/title/1264,22068082;issn,1872-12-20,5.0,5,None,None,None,None,Tasmania,N,2036 words,Article,"George Pawkins, retired, grocer and tallow-chandler, was out of business. People styled him retired gentleman ; at all events, he resided"
19,177544436,https://api.trove.nla.gov.au/v3/newspaper/177544436,https://nla.gov.au/nla.news-article177544436,https://nla.gov.au/nla.news-page20124737,https://trove.nla.gov.au/ndp/imageservice/nla.news-page20124737/print,PLAYING THE GHOST.,"Tasmanian News (Hobart, Tas. : 1883 - 1911)",https://nla.gov.au/nla.news-title866,https://api.trove.nla.gov.au/v3/newspaper/title/866,22037098;issn,1896-06-02,2.0,2 S,None,None,None,THIRD EDITION,Tasmania,N,2 words,Article,THERE is still some sentences individual playing the ghost—this come in the vicinity of the descries burial ground of St. Andrew's on Trinity Hall The
20,177554724,https://api.trove.nla.gov.au/v3/newspaper/177554724,https://nla.gov.au/nla.news-article177554724,https://nla.gov.au/nla.news-page20125349,https://trove.nla.gov.au/ndp/imageservice/nla.news-page20125349/print,ANOTHER GHOST STORY.,"Tasmanian News (Hobart, Tas. : 1883 - 1911)",https://nla.gov.au/nla.news-title866,https://api.trove.nla.gov.au/v3/newspaper/title/866,22037098;issn,1896-11-23,2.0,2 S,None,None,None,THIRD EDITION,Tasmania,N,456 words,Article,"THE Rev. Arthur Clay Ly wood of Hiton, sends the following story of a vision to the Daily Telegraph, which ought to [?] eat the members of the Psychical"
21,35375348,https://api.trove.nla.gov.au/v3/newspaper/35375348,https://nla.gov.au/nla.news-article35375348,https://nla.gov.au/nla.news-page3006260,https://trove.nla.gov.au/ndp/imageservice/nla.news-page3006260/print,ANOTHER GHOST VANISHES.,"Examiner (Launceston, Tas. : 1900 - 1954)",https://nla.gov.au/nla.news-title68,https://api.trove.nla.gov.au/v3/newspaper/title/68,13210971;issn,1900-10-20,13.0,13 S,None,None,None,DAILY,Tasmania,N,128 words,Article,"For some time Malew, in the Isle of Man, has boasted of a ghost haunting its parish church. The spectre was said to walk nightly up the aisle, candle in"
22,153223218,https://api.trove.nla.gov.au/v3/newspaper/153223218,https://nla.gov.au/nla.news-article153223218,https://nla.gov.au/nla.news-page18410067,https://trove.nla.gov.au/ndp/imageservice/nla.news-page18410067/print,INDIAN GHOST CHARMS.,"Daily Telegraph (Launceston, Tas. : 1883 - 1928)",https://nla.gov.au/nla.news-title742,https://api.trove.nla.gov.au/v3/newspaper/title/742,22029117;issn,1892-01-16,6.0,6,None,None,None,None,Tasmania,N,486 words,Article,Diseases Attributed to the Mallg[?]y of kvil Spirits—Propitisting the Ghosts. The dread of ghosts is common to all the aboriginal races of In[?]is from whom
23,153507587,https://api.trove.nla.gov.au/v3/newspaper/153507587,https://nla.gov.au/nla.news-article153507587,https://nla.gov.au/nla.news-page18384629,https://trove.nla.gov.au/ndp/imageservice/nla.news-page18384629/print,THE GHOST SCARE.,"Daily Telegraph (Launceston, Tas. : 1883 - 1928)",https://nla.gov.au/nla.news-title742,https://api.trove.nla.gov.au/v3/newspaper/title/742,22029117;issn,1896-07-14,3.0,3,None,None,None,None,Tasmania,N,78 words,Article,"HOBART, MONDAY.— The ghost scare is still rampant, Last night a man named Mulligan is sald to have encountered the apparition in the shape of an overgrown"
24,36642620,https://api.trove.nla.gov.au/v3/newspaper/36642620,https://nla.gov.au/nla.news-article36642620,https://nla.gov.au/nla.news-page3603186,https://trove.nla.gov.au/ndp/imageservice/nla.news-page3603186/print,THE CHICAGO GHOST.,Launceston Examiner (Tas. : 1842 - 1899),https://nla.gov.au/nla.news-title74,https://api.trove.nla.gov.au/v3/newspaper/title/74,18368204;issn,1867-03-21,2.0,2,None,None,None,None,Tasmania,N,1417 words,Article,The [?] Chicago Republican of November 23rd contains  the following particulars concerning the alleged ghost in that city:— The report published in yesterday
25,39597852,https://api.trove.nla.gov.au/v3/newspaper/39597852,https://nla.gov.au/nla.news-article39597852,https://nla.gov.au/nla.news-page2940895,https://trove.nla.gov.au/ndp/imageservice/nla.news-page2940895/print|https://trove.nla.gov.au/ndp/imageservice/nla.news-page2940896/print,OLD GRIDLEY'S GHOST.,Launceston Examiner (Tas. : 1842 - 1899),https://nla.gov.au/nla.news-title74,https://api.trove.nla.gov.au/v3/newspaper/title/74,18368204;issn,1894-12-22,4.0,4 S,None,CHRISTMAS SUPPLEMENT TO THE Launceston Examiner AND The Tasmanian.,None,None,Tasmania,N,1767 words,Article,"""WHY, Dunham, what's the matter? How your hand trembles! Are you sick?"" ""No; not exactly. ""What ails you then? Speak out, man. Have"
26,52886677,https://api.trove.nla.gov.au/v3/newspaper/52886677,https://nla.gov.au/nla.news-article52886677,https://nla.gov.au/nla.news-page3654635,https://trove.nla.gov.au/ndp/imageservice/nla.news-page3654635/print,A GHOST STORY.,Launceston Examiner (Tas. : 1842 - 1899),https://nla.gov.au/nla.news-title74,https://api.trove.nla.gov.au/v3/newspaper/title/74,18368204;issn,1873-05-24,2.0,2,None,None,None,None,Tasmania,N,618 words,Article,"For some years past the vicinity of Carrick has been frequented by ghosts, especially the Westbury side of the bridge a lady dressed in white (so says report) being often seen of a night taking"
27,83365910,https://api.trove.nla.gov.au/v3/newspaper/83365910,https://nla.gov.au/nla.news-article83365910,https://nla.gov.au/nla.news-page8365201,https://trove.nla.gov.au/ndp/imageservice/nla.news-page8365201/print,A GHOST'S RHAPSODY.,"The Clipper (Hobart, Tas. : 1893 - 1909)",https://nla.gov.au/nla.news-title271,https://api.trove.nla.gov.au/v3/newspaper/title/271,1839714X;issn,1895-08-10,6.0,6,None,None,None,None,Tasmania,N,444 words,Article,"The ghost has roused the the bummers' ire They threaten him with vengeance dire, If thus again he strikes the lyre. He'll rue it"
28,8763963,https://api.trove.nla.gov.au/v3/newspaper/8763963,https://nla.gov.au/nla.news-article8763963,https://nla.gov.au/nla.news-page673721,https://trove.nla.gov.au/ndp/imageservice/nla.news-page673721/print,GHOST STORY. (ORIGINAL.),"Colonial Times (Hobart, Tas. : 1828 - 1857)",https://nla.gov.au/nla.news-title24,https://api.trove.nla.gov.au/v3/newspaper/title/24,18354734;issn,1848-12-01,4.0,4,None,None,None,None,Tasmania,N,1836 words,Article,"""But why should not God interfere in the trifling concerns of human hei[?]gs? Are not human beings themselves altogether trifling?"" said my friend to me, as we walked home from a home"
29,150273378,https://api.trove.nla.gov.au/v3/newspaper/150273378,https://nla.gov.au/nla.news-article150273378,https://nla.gov.au/nla.news-page18411392,https://trove.nla.gov.au/ndp/imageservice/nla.news-page18411392/print,THE BEACONSFIELD GHOST.,"Daily Telegraph (Launceston, Tas. : 1883 - 1928)",https://nla.gov.au/nla.news-title742,https://api.trove.nla.gov.au/v3/newspaper/title/742,22029117;issn,1888-08-16,3.0,3,None,None,None,None,Tasmania,N,205 words,Article,"SIR,—Will you kindly allow space for a few remarks on the above subject, viz., the ghost. This individual, who is either a fool or villain, or, perhaps, a mixture of"
30,185245134,https://api.trove.nla.gov.au/v3/newspaper/185245134,https://nla.gov.au/nla.news-article185245134,https://nla.gov.au/nla.news-page20126439,https://trove.nla.gov.au/ndp/imageservice/nla.news-page20126439/print,THE GHOST SOARE.,"Tasmanian News (Hobart, Tas. : 1883 - 1911)",https://nla.gov.au/nla.news-title866,https://api.trove.nla.gov.au/v3/newspaper/title/866,22037098;issn,1900-09-01,4.0,4 S,None,None,None,THIRD EDITION,Tasmania,N,43 words,Article,"A ghost has made his appearance at Latrobe and frightened several people. SORELL — In [?] doings, cables"
31,38284722,https://api.trove.nla.gov.au/v3/newspaper/38284722,https://nla.gov.au/nla.news-article38284722,https://nla.gov.au/nla.news-page3287091,https://trove.nla.gov.au/ndp/imageservice/nla.news-page3287091/print,TRUE GHOST STORIES.,Launceston Examiner (Tas. : 1842 - 1899),https://nla.gov.au/nla.news-title74,https://api.trove.nla.gov.au/v3/newspaper/title/74,18368204;issn,1883-05-23,3.0,3,None,None,None,None,Tasmania,N,662 words,Article,"The two ghost stories told by our most eminent anatomist are as romantic in their way as any told by the Psychological Society. When, hardly more than a lad"
34,200313326,https://api.trove.nla.gov.au/v3/newspaper/200313326,https://nla.gov.au/nla.news-article200313326,https://nla.gov.au/nla.news-page22080426,https://trove.nla.gov.au/ndp/imageservice/nla.news-page22080426/print,TRUE GHOST STORIES,"The Tasmanian (Launceston, Tas. : 1881 - 1895)",https://nla.gov.au/nla.news-title947,https://api.trove.nla.gov.au/v3/newspaper/title/947,2204583X;issn,1883-05-26,558.0,558,None,None,None,None,Tasmania,N,579 words,Article,"The two ghost stories told by our most eminent anatomist are as romantic in their way as any told by the Psychological Society. When, hardly more than a lad"
36,79699030,https://api.trove.nla.gov.au/v3/newspaper/79699030,https://nla.gov.au/nla.news-article79699030,https://nla.gov.au/nla.news-page8286658,https://trove.nla.gov.au/ndp/imageservice/nla.news-page8286658/print,GHOST IN LAUNCESTON,Zeehan and Dundas Herald (Tas. : 1890 - 1922),https://nla.gov.au/nla.news-title270,https://api.trove.nla.gov.au/v3/newspaper/title/270,18397158;issn,1894-09-28,4.0,4,None,None,None,None,Tasmania,N,443 words,Article,"Between 8 and 9 o'clock last Monday evening great commotion was caused in upper Charles-street, Launceston, by the appearance of a ghost at one of the "
37,173881911,https://api.trove.nla.gov.au/v3/newspaper/173881911,https://nla.gov.au/nla.news-article173881911,https://nla.gov.au/nla.news-page20119552,https://trove.nla.gov.au/ndp/imageservice/nla.news-page20119552/print,FEEING A GHOST.,"Tasmanian News (Hobart, Tas. : 1883 - 1911)",https://nla.gov.au/nla.news-title866,https://api.trove.nla.gov.au/v3/newspaper/title/866,22037098;issn,1895-08-27,2.0,2 S,None,None,None,SECOND EDITION,Tasmania,N,422 words,Article,"THE Countess of Munster must be classed among the select few who have seen—or think they have seen—a ghost. It seems, according to her own account, which"
40,177546751,https://api.trove.nla.gov.au/v3/newspaper/177546751,https://nla.gov.au/nla.news-article177546751,https://nla.gov.au/nla.news-page20124875,https://trove.nla.gov.au/ndp/imageservice/nla.news-page20124875/print,THE GHOST SEANDAL.,"Tasmanian News (Hobart, Tas. : 1883 - 1911)",https://nla.gov.au/nla.news-title866,https://api.trove.nla.gov.au/v3/newspaper/title/866,22037098;issn,1896-07-10,2.0,2 S,None,None,None,THIRD EDITION,Tasmania,N,212 words,Article,THE reply given by Ministers yesterday to Dr Crosther as to taking steps for the suppreseal of the individual who is going about frightemag lone females who
41,177544512,https://api.trove.nla.gov.au/v3/newspaper/177544512,https://nla.gov.au/nla.news-article177544512,https://nla.gov.au/nla.news-page20124741,https://trove.nla.gov.au/ndp/imageservice/nla.news-page20124741/print,THE GHOST AGAIN.,"Tasmanian News (Hobart, Tas. : 1883 - 1911)",https://nla.gov.au/nla.news-title866,https://api.trove.nla.gov.au/v3/newspaper/title/866,22037098;issn,1896-06-03,2.0,2 S,None,None,None,THIRD EDITION,Tasmania,N,2 words,Article,[?] dark last evening a large number of persons wended their way in the direction of the [?]
42,200376202,https://api.trove.nla.gov.au/v3/newspaper/200376202,https://nla.gov.au/nla.news-article200376202,https://nla.gov.au/nla.news-page22161392,https://trove.nla.gov.au/ndp/imageservice/nla.news-page22161392/print|https://trove.nla.gov.au/ndp/imageservice/nla.news-page22161393/print,THE WESTBURY GHOST.,"The Tasmanian Tribune (Hobart Town, Tas. : 1872 - 1876)",https://nla.gov.au/nla.news-title950,https://api.trove.nla.gov.au/v3/newspaper/title/950,22046321;issn,1873-05-24,2.0,2,None,None,None,None,Tasmania,N,641 words,Article,"For some years past the vicinity of Carrick has been frequented by ghosts, especially the Westbury side of the bridge a lady dressed"
43,39639939,https://api.trove.nla.gov.au/v3/newspaper/39639939,https://nla.gov.au/nla.news-article39639939,https://nla.gov.au/nla.news-page2951144,https://trove.nla.gov.au/ndp/imageservice/nla.news-page2951144/print,A GHOST INCIDENT.,Launceston Examiner (Tas. : 1842 - 1899),https://nla.gov.au/nla.news-title74,https://api.trove.nla.gov.au/v3/newspaper/title/74,18368204;issn,1897-01-30,4.0,4,None,None,None,None,Tasmania,N,213 words,Article,"""Talking of ghosts,"" said the man in corduroy, ""I had an experience once that nearly turned my hair grey. I arrived late at night in a little valley town out"
44,64886115,https://api.trove.nla.gov.au/v3/newspaper/64886115,https://nla.gov.au/nla.news-article64886115,https://nla.gov.au/nla.news-page5228042,https://trove.nla.gov.au/ndp/imageservice/nla.news-page5228042/print,A GHOST SCARE.,Wellington Times and Agricultural and Mining Gazette (Tas. : 1890 - 1897),https://nla.gov.au/nla.news-title117,https://api.trove.nla.gov.au/v3/newspaper/title/117,18379702;issn,1895-09-05,4.0,4,None,None,None,None,Tasmania,N,418 words,Article,"Some uneasiness has been created among residents of Richmond, Victoria, by the appearance of a mischievous idiot who has been figuring in the Northern suburbs. The"
45,186371503,https://api.trove.nla.gov.au/v3/newspaper/186371503,https://nla.gov.au/nla.news-article186371503,https://nla.gov.au/nla.news-page20193567,https://trove.nla.gov.au/ndp/imageservice/nla.news-page20193567/print,MORE GHOST STORIES.,"Devon Herald (Latrobe, Tas. : 1877 - 1889)",https://nla.gov.au/nla.news-title862,https://api.trove.nla.gov.au/v3/newspaper/title/862,22037071;issn,1883-07-18,2.0,2 S,None,Supplement to the Devon Herald,None,None,Tasmania,N,419 words,Article,"Mr. Heart’s ghost story,  published in our last week a fescue caused considerable interest and discussion on it recent republication in pamphlet from in London. A correspondent"
47,65250583,https://api.trove.nla.gov.au/v3/newspaper/65250583,https://nla.gov.au/nla.news-article65250583,https://nla.gov.au/nla.news-page5230111,https://trove.nla.gov.au/ndp/imageservice/nla.news-page5230111/print,MY UNCLE'S GHOST.,Wellington Times and Agricultural and Mining Gazette (Tas. : 1890 - 1897),https://nla.gov.au/nla.news-title117,https://api.trove.nla.gov.au/v3/newspaper/title/117,18379702;issn,1892-02-06,1.0,1 S,None,Supplement to the Wellington Times.,None,None,Tasmania,N,2177 words,Article,One rainy evening last week I lounged into my uncle's bachelor apartments at the hotel for a talk and smoke. One of my uncle's hobbies was to be surrounded at all
48,84538745,https://api.trove.nla.gov.au/v3/newspaper/84538745,https://nla.gov.au/nla.news-article84538745,https://nla.gov.au/nla.news-page8626918,https://trove.nla.gov.au/ndp/imageservice/nla.news-page8626918/print,A GHOST YARN,Zeehan and Dundas Herald (Tas. : 1890 - 1922),https://nla.gov.au/nla.news-title270,https://api.trove.nla.gov.au/v3/newspaper/title/270,18397158;issn,1896-12-25,4.0,4 S,None,SUPPLEMENT TO THE Zeehan & Dundas Herald.,None,None,Tasmania,N,242 words,Article,"A young gentleman who lately left his father's house, having exhausted hit credit telegraphed the other day to his parents: "" Your eon Walter was killed this morning"
49,201169146,https://api.trove.nla.gov.au/v3/newspaper/201169146,https://nla.gov.au/nla.news-article201169146,https://nla.gov.au/nla.news-page22158492,https://trove.nla.gov.au/ndp/imageservice/nla.news-page22158492/print,A CAPITAL GHOST STORY. ALL ABOUT A GHOST.,"The Tasmanian Tribune (Hobart Town, Tas. : 1872 - 1876)",https://nla.gov.au/nla.news-title950,https://api.trove.nla.gov.au/v3/newspaper/title/950,22046321;issn,1874-10-07,4.0,4,None,None,None,None,Tasmania,N,436 words,Article,"From time to time we (Show haven News) have received starting intelligence from Bamerang anent a ghost, or rather ghosts, that have been soon"
50,39600902,https://api.trove.nla.gov.au/v3/newspaper/39600902,https://nla.gov.au/nla.news-article39600902,https://nla.gov.au/nla.news-page2952596,https://trove.nla.gov.au/ndp/imageservice/nla.news-page2952596/print,FICTION. THE HIGHWAYMAN'S GHOST.,Launceston Examiner (Tas. : 1842 - 1899),https://nla.gov.au/nla.news-title74,https://api.trove.nla.gov.au/v3/newspaper/title/74,18368204;issn,1895-02-04,3.0,3,None,None,None,None,Tasmania,N,1510 words,Article,"""Towards the end of this wonderful performance the landlord had turned his back. Shaking like a jelly I had the handle of a toddy ladle between my"
51,8967297,https://api.trove.nla.gov.au/v3/newspaper/8967297,https://nla.gov.au/nla.news-article8967297,https://nla.gov.au/nla.news-page794035,https://trove.nla.gov.au/ndp/imageservice/nla.news-page794035/print,D'ARCY READ'S GHOST.,"The Mercury (Hobart, Tas. : 1860 - 1954)",https://nla.gov.au/nla.news-title10,https://api.trove.nla.gov.au/v3/newspaper/title/10,10399992;issn,1878-08-29,2.0,2,None,None,None,None,Tasmania,N,499 words,Article,"The announcement that D'Arcy Bead's Ghost or Spectrescope would be exhibited in the Town Hall last evening drew together a large audience, amongst those present being several members of both Houses of"
52,162982406,https://api.trove.nla.gov.au/v3/newspaper/162982406,https://nla.gov.au/nla.news-article162982406,https://nla.gov.au/nla.news-page20001993,https://trove.nla.gov.au/ndp/imageservice/nla.news-page20001993/print,A BARRACK GHOST STORY.,"Tasmanian News (Hobart, Tas. : 1883 - 1911)",https://nla.gov.au/nla.news-title866,https://api.trove.nla.gov.au/v3/newspaper/title/866,22037098;issn,1886-06-22,4.0,4,None,None,None,None,Tasmania,N,2757 words,Article,"“Prisoner, have you any objection to be tried by me as President, or by any member of this court-martial asked the field-officer who had been"
53,153375468,https://api.trove.nla.gov.au/v3/newspaper/153375468,https://nla.gov.au/nla.news-article153375468,https://nla.gov.au/nla.news-page18409588,https://trove.nla.gov.au/ndp/imageservice/nla.news-page18409588/print,A LIVERPOOL GHOST STORY.,"Daily Telegraph (Launceston, Tas. : 1883 - 1928)",https://nla.gov.au/nla.news-title742,https://api.trove.nla.gov.au/v3/newspaper/title/742,22029117;issn,1891-09-19,3.0,3,None,None,None,None,Tasmania,N,977 words,Article,"""Having been concerned in a most remarkable and altogether inexplicable adventure the other evening, which happened to me in Thomas-lane, Knotty"
